No.,Time,Source,Destination,Protocol,Length,Info,Source Port,Destination Port,Human
2,0.133314,3232281142,2902291551,TCP,55,49445  >  443 [ACK] Seq=1 Ack=1 Win=507 Len=1 [TCP segment of a reassembled PDU],49445,443,0
3,0.13944,2902291551,3232281142,TCP,66,443  >  49445 [ACK] Seq=1 Ack=2 Win=278 Len=0 SLE=1 SRE=2,443,49445,0
5,0.204968,3232281136,4294967295,UDP,56,60048  >  3289 Len=14,60048,3289,0
7,0.77774,1249755487,3232281142,TLSv1.2,139,Application Data,443,49196,1
8,0.77774,1249755487,3232281142,TLSv1.2,85,Application Data,443,49196,1
9,0.77774,1249755487,3232281142,TLSv1.2,93,Application Data,443,49196,1
10,0.777844,3232281142,1249755487,TCP,54,49196  >  443 [ACK] Seq=1 Ack=156 Win=509 Len=0,49196,443,0
11,0.77805,3232281142,1249755487,TLSv1.2,89,Application Data,49196,443,1
12,0.778084,3232281142,1249755487,TLSv1.2,93,Application Data,49196,443,1
13,0.784545,1249755487,3232281142,TCP,54,443  >  49196 [ACK] Seq=156 Ack=36 Win=430 Len=0,443,49196,0
14,0.784545,1249755487,3232281142,TCP,54,443  >  49196 [ACK] Seq=156 Ack=75 Win=430 Len=0,443,49196,0
15,0.794483,3232281142,1249755487,TLSv1.2,284,Application Data,49195,443,1
16,0.794526,3232281142,1249755487,TLSv1.2,93,Application Data,49195,443,1
17,0.800719,1249755487,3232281142,TCP,54,443  >  49195 [ACK] Seq=1 Ack=270 Win=322 Len=0,443,49195,0
18,0.800719,1249755487,3232281142,TLSv1.2,93,Application Data,443,49195,1
19,0.841252,3232281142,1249755487,TCP,54,49195  >  443 [ACK] Seq=270 Ack=40 Win=512 Len=0,49195,443,0
20,0.90171,1249755487,3232281142,TLSv1.2,123,Application Data,443,49195,1
21,0.90171,1249755487,3232281142,TLSv1.2,85,Application Data,443,49195,1
22,0.901807,3232281142,1249755487,TCP,54,49195  >  443 [ACK] Seq=270 Ack=140 Win=511 Len=0,49195,443,0
23,0.903084,3232281142,1249755487,TCP,1466,49196  >  443 [ACK] Seq=75 Ack=156 Win=509 Len=1412 [TCP segment of a reassembled PDU],49196,443,0
24,0.903084,3232281142,1249755487,TCP,1466,49196  >  443 [ACK] Seq=1487 Ack=156 Win=509 Len=1412 [TCP segment of a reassembled PDU],49196,443,0
25,0.903084,3232281142,1249755487,TLSv1.2,191,Application Data,49196,443,1
26,0.90596,1249755487,3232281142,TLSv1.2,93,Application Data,443,49195,1
27,0.906386,3232281142,1249755487,TLSv1.2,93,Application Data,49195,443,1
28,0.909144,1249755487,3232281142,TCP,54,443  >  49196 [ACK] Seq=156 Ack=1487 Win=441 Len=0,443,49196,0
29,0.909144,1249755487,3232281142,TCP,54,443  >  49196 [ACK] Seq=156 Ack=2899 Win=452 Len=0,443,49196,0
30,0.909144,1249755487,3232281142,TCP,54,443  >  49196 [ACK] Seq=156 Ack=3036 Win=463 Len=0,443,49196,0
31,0.917087,1249755487,3232281142,TCP,54,443  >  49195 [ACK] Seq=179 Ack=309 Win=322 Len=0,443,49195,0
32,1.006532,1249755487,3232281142,TLSv1.2,121,Application Data,443,49196,1
33,1.006532,1249755487,3232281142,TLSv1.2,103,Application Data,443,49196,1
34,1.006588,3232281142,1249755487,TCP,54,49196  >  443 [ACK] Seq=3036 Ack=272 Win=509 Len=0,49196,443,0
38,1.742761,0,4294967295,DHCP,590,DHCP Discover - Transaction ID 0x66ecf19c,68,67,0
39,1.742761,3232281089,4294967295,DHCP,590,DHCP Offer    - Transaction ID 0x66ecf19c,67,68,0
40,2.12483,2354213146,3232281142,TLSv1.2,79,Application Data,443,65140,1
41,2.125582,3232281142,2354213146,TLSv1.2,83,Application Data,65140,443,1
42,2.21556,2354213146,3232281142,TCP,54,443  >  65140 [ACK] Seq=26 Ack=30 Win=70 Len=0,443,65140,0
43,2.764926,3232281112,3232281343,UDP,77,41085  >  15600 Len=35,41085,15600,0
48,3.275037,3232281142,3512060521,TLSv1.2,1404,"Application Data, Application Data",49338,443,0
49,3.275101,3232281142,3512060521,TLSv1.2,93,Application Data,49338,443,1
54,3.282083,3512060521,3232281142,TCP,54,443  >  49338 [ACK] Seq=1 Ack=1351 Win=6419 Len=0,443,49338,0
55,3.282083,3512060521,3232281142,TCP,54,443  >  49338 [ACK] Seq=1 Ack=1390 Win=6419 Len=0,443,49338,0
56,3.282083,3512060521,3232281142,TLSv1.2,93,Application Data,443,49338,1
57,3.282784,3232281142,3512060521,TLSv1.2,1466,Application Data,49338,443,1
58,3.282784,3232281142,3512060521,TLSv1.2,147,Application Data,49338,443,1
59,3.289538,3512060521,3232281142,TCP,54,443  >  49338 [ACK] Seq=40 Ack=2895 Win=6430 Len=0,443,49338,0
60,3.300385,3232281142,3512060521,TLSv1.2,1453,"Application Data, Application Data",49338,443,0
61,3.309705,3512060521,3232281142,TLSv1.2,343,Application Data,443,49338,1
62,3.309705,3512060521,3232281142,TLSv1.2,108,Application Data,443,49338,1
63,3.309847,3232281142,3512060521,TCP,54,49338  >  443 [ACK] Seq=4294 Ack=383 Win=2469 Len=0,49338,443,0
64,3.310974,3512060521,3232281142,TLSv1.2,85,Application Data,443,49338,1
65,3.310974,3512060521,3232281142,TLSv1.2,93,Application Data,443,49338,1
66,3.311034,3232281142,3512060521,TCP,54,49338  >  443 [ACK] Seq=4294 Ack=453 Win=2469 Len=0,49338,443,0
67,3.311682,3232281142,3512060521,TLSv1.2,93,Application Data,49338,443,1
68,3.312555,3232281142,3512060521,TLSv1.2,89,Application Data,49338,443,1
69,3.318444,3512060521,3232281142,TCP,54,443  >  49338 [ACK] Seq=453 Ack=4368 Win=6441 Len=0,443,49338,0
70,3.335486,3512060521,3232281142,TLSv1.2,314,Application Data,443,49338,1
71,3.335486,3512060521,3232281142,TLSv1.2,118,Application Data,443,49338,1
72,3.335486,3512060521,3232281142,TLSv1.2,85,Application Data,443,49338,1
73,3.335486,3512060521,3232281142,TLSv1.2,93,Application Data,443,49338,1
74,3.335689,3232281142,3512060521,TCP,54,49338  >  443 [ACK] Seq=4368 Ack=847 Win=2467 Len=0,49338,443,0
75,3.337247,3232281142,3512060521,TLSv1.2,93,Application Data,49338,443,1
76,3.340133,3512060521,3232281142,TLSv1.2,438,Application Data,443,49338,1
77,3.340133,3512060521,3232281142,TLSv1.2,1466,Application Data,443,49338,1
78,3.340133,3512060521,3232281142,TLSv1.2,1466,Application Data,443,49338,1
79,3.340133,3512060521,3232281142,TLSv1.2,85,Application Data,443,49338,1
80,3.340133,3512060521,3232281142,TLSv1.2,217,Application Data,443,49338,1
81,3.340212,3232281142,3512060521,TCP,54,49338  >  443 [ACK] Seq=4407 Ack=4249 Win=2471 Len=0,49338,443,0
82,3.342493,3512060521,3232281142,TLSv1.2,1466,Application Data,443,49338,1
83,3.342493,3512060521,3232281142,TLSv1.2,1466,Application Data,443,49338,1
84,3.342493,3512060521,3232281142,TLSv1.2,1466,Application Data,443,49338,1
85,3.342493,3512060521,3232281142,TLSv1.2,1466,Application Data,443,49338,1
86,3.342493,3512060521,3232281142,TLSv1.2,1466,Application Data,443,49338,1
87,3.342493,3512060521,3232281142,TLSv1.2,1466,Application Data,443,49338,1
88,3.342493,3512060521,3232281142,TLSv1.2,1466,Application Data,443,49338,1
89,3.342493,3512060521,3232281142,TLSv1.2,1466,Application Data,443,49338,1
90,3.342493,3512060521,3232281142,TLSv1.2,1466,Application Data,443,49338,1
91,3.342493,3512060521,3232281142,TLSv1.2,1466,Application Data,443,49338,1
92,3.342493,3512060521,3232281142,TLSv1.2,1466,Application Data,443,49338,1
93,3.342493,3512060521,3232281142,TLSv1.2,1179,Application Data,443,49338,1
94,3.342493,3512060521,3232281142,TLSv1.2,1466,Application Data,443,49338,1
95,3.342493,3512060521,3232281142,TLSv1.2,1466,Application Data,443,49338,1
96,3.342493,3512060521,3232281142,TLSv1.2,1466,Application Data,443,49338,1
97,3.342493,3512060521,3232281142,TLSv1.2,1466,Application Data,443,49338,1
98,3.342493,3512060521,3232281142,TLSv1.2,1466,Application Data,443,49338,1
99,3.342493,3512060521,3232281142,TLSv1.2,1466,Application Data,443,49338,1
100,3.342493,3512060521,3232281142,TLSv1.2,1466,Application Data,443,49338,1
101,3.342493,3512060521,3232281142,TLSv1.2,1466,Application Data,443,49338,1
102,3.342493,3512060521,3232281142,TLSv1.2,1466,Application Data,443,49338,1
103,3.342493,3512060521,3232281142,TLSv1.2,1466,Application Data,443,49338,1
104,3.342493,3512060521,3232281142,TLSv1.2,1466,Application Data,443,49338,1
105,3.342493,3512060521,3232281142,TLSv1.2,1179,Application Data,443,49338,1
106,3.342493,3512060521,3232281142,TLSv1.2,1466,Application Data,443,49338,1
107,3.342493,3512060521,3232281142,TLSv1.2,1466,Application Data,443,49338,1
108,3.342493,3512060521,3232281142,TLSv1.2,638,Application Data,443,49338,1
109,3.342493,3512060521,3232281142,TLSv1.2,85,Application Data,443,49338,1
110,3.342804,3232281142,3512060521,TCP,54,49338  >  443 [ACK] Seq=4407 Ack=41002 Win=2471 Len=0,49338,443,0
111,3.347598,3512060521,3232281142,TCP,54,443  >  49338 [ACK] Seq=41002 Ack=4407 Win=6441 Len=0,443,49338,0
112,3.732052,60984449,3232281142,TLSv1.2,78,Application Data,443,49604,1
113,3.732052,60984449,3232281142,TCP,54,"443  >  49604 [FIN, ACK] Seq=25 Ack=1 Win=131 Len=0",443,49604,0
114,3.732159,3232281142,60984449,TCP,54,49604  >  443 [ACK] Seq=1 Ack=26 Win=514 Len=0,49604,443,0
116,3.850671,34740242,3232281142,TCP,54,"80  >  50590 [FIN, ACK] Seq=1 Ack=1 Win=501 Len=0",80,50590,0
117,3.850671,34740242,3232281142,TCP,54,"80  >  50593 [FIN, ACK] Seq=1 Ack=1 Win=501 Len=0",80,50593,0
118,3.850671,34740242,3232281142,TCP,54,"80  >  50591 [FIN, ACK] Seq=1 Ack=1 Win=501 Len=0",80,50591,0
119,3.850743,3232281142,34740242,TCP,54,50590  >  80 [RST] Seq=1 Win=0 Len=0,50590,80,0
120,3.850815,3232281142,34740242,TCP,54,50593  >  80 [RST] Seq=1 Win=0 Len=0,50593,80,0
121,3.850824,3232281142,34740242,TCP,54,50591  >  80 [RST] Seq=1 Win=0 Len=0,50591,80,0
122,3.859619,34740242,3232281142,TCP,54,"80  >  50592 [FIN, ACK] Seq=1 Ack=1 Win=501 Len=0",80,50592,0
123,3.859652,3232281142,34740242,TCP,54,50592  >  80 [RST] Seq=1 Win=0 Len=0,50592,80,0
124,4.362804,2817227836,3232281142,TLSv1.2,78,Application Data,443,49644,1
125,4.362804,2817227836,3232281142,TCP,54,"443  >  49644 [FIN, ACK] Seq=25 Ack=1 Win=165 Len=0",443,49644,0
126,4.362901,3232281142,2817227836,TCP,54,49644  >  443 [ACK] Seq=1 Ack=26 Win=512 Len=0,49644,443,0
127,4.495666,2817227836,3232281142,TLSv1.2,78,Application Data,443,49649,1
128,4.495666,2817227836,3232281142,TCP,54,"443  >  49649 [FIN, ACK] Seq=25 Ack=1 Win=165 Len=0",443,49649,0
129,4.495742,3232281142,2817227836,TCP,54,49649  >  443 [ACK] Seq=1 Ack=26 Win=513 Len=0,49649,443,0
130,4.540755,2817227836,3232281142,TLSv1.2,78,Application Data,443,49650,1
131,4.540755,2817227836,3232281142,TCP,54,"443  >  49650 [FIN, ACK] Seq=25 Ack=1 Win=165 Len=0",443,49650,0
132,4.541008,3232281142,2817227836,TCP,54,49650  >  443 [ACK] Seq=1 Ack=26 Win=512 Len=0,49650,443,0
133,4.727076,388301171,3232281142,TLSv1.2,85,Encrypted Alert,443,50605,0
134,4.727076,388301171,3232281142,TCP,54,"443  >  50605 [FIN, ACK] Seq=32 Ack=1 Win=501 Len=0",443,50605,0
135,4.727133,3232281142,388301171,TCP,54,50605  >  443 [RST] Seq=1 Win=0 Len=0,50605,443,0
136,4.727171,3232281142,388301171,TCP,54,50605  >  443 [RST] Seq=1 Win=0 Len=0,50605,443,0
137,4.966237,399010191,3232281142,TLSv1.2,85,Encrypted Alert,443,50604,0
138,4.966237,399010191,3232281142,TCP,54,"443  >  50604 [FIN, ACK] Seq=32 Ack=1 Win=501 Len=0",443,50604,0
139,4.966372,3232281142,399010191,TCP,54,50604  >  443 [RST] Seq=1 Win=0 Len=0,50604,443,0
140,4.966473,3232281142,399010191,TCP,54,50604  >  443 [RST] Seq=1 Win=0 Len=0,50604,443,0
144,5.69127,3232281112,4026531834,UDP,77,35247  >  15600 Len=35,35247,15600,0
146,5.957925,389063955,3232281142,TLSv1.2,85,Encrypted Alert,443,50617,0
147,5.957925,389063955,3232281142,TCP,54,"443  >  50617 [FIN, ACK] Seq=32 Ack=1 Win=501 Len=0",443,50617,0
148,5.958059,3232281142,389063955,TCP,54,50617  >  443 [RST] Seq=1 Win=0 Len=0,50617,443,0
149,5.958166,3232281142,389063955,TCP,54,50617  >  443 [RST] Seq=1 Win=0 Len=0,50617,443,0
150,6.039241,3232281142,3512060511,TLSv1.2,118,Application Data,49342,443,1
151,6.03932,3232281142,3512060511,TLSv1.2,93,Application Data,49342,443,1
152,6.039341,3232281142,3512060511,TLSv1.2,165,Application Data,49342,443,1
154,6.040366,3232281142,3232281089,TCP,66,49760  >  53 [SYN] Seq=0 Win=64240 Len=0 MSS=1460 WS=256 SACK_PERM,49760,53,0
155,6.040596,3232281142,3232281089,TCP,66,49761  >  53 [SYN] Seq=0 Win=64240 Len=0 MSS=1460 WS=256 SACK_PERM,49761,53,0
156,6.040789,3232281142,3232281089,TCP,66,49762  >  53 [SYN] Seq=0 Win=64240 Len=0 MSS=1460 WS=256 SACK_PERM,49762,53,0
157,6.040909,3232281142,3232281089,TCP,66,49763  >  53 [SYN] Seq=0 Win=64240 Len=0 MSS=1460 WS=256 SACK_PERM,49763,53,0
158,6.041075,3232281142,3232281089,TCP,66,49764  >  53 [SYN] Seq=0 Win=64240 Len=0 MSS=1460 WS=256 SACK_PERM,49764,53,0
159,6.041179,3232281142,3232281089,TCP,66,49765  >  53 [SYN] Seq=0 Win=64240 Len=0 MSS=1460 WS=256 SACK_PERM,49765,53,0
160,6.043612,3232281142,2817227836,TCP,54,"49649  >  443 [FIN, ACK] Seq=1 Ack=26 Win=513 Len=0",49649,443,0
161,6.043663,3232281142,2817227836,TCP,54,"49649  >  443 [RST, ACK] Seq=2 Ack=26 Win=0 Len=0",49649,443,0
162,6.043787,3232281142,60984449,TCP,54,"49604  >  443 [FIN, ACK] Seq=1 Ack=26 Win=514 Len=0",49604,443,0
163,6.043853,3232281142,2817227836,TCP,54,"49650  >  443 [FIN, ACK] Seq=1 Ack=26 Win=512 Len=0",49650,443,0
164,6.043874,3232281142,2817227836,TCP,54,"49650  >  443 [RST, ACK] Seq=2 Ack=26 Win=0 Len=0",49650,443,0
165,6.043997,3232281142,2817227836,TCP,54,"49644  >  443 [FIN, ACK] Seq=1 Ack=26 Win=512 Len=0",49644,443,0
166,6.044017,3232281142,2817227836,TCP,54,"49644  >  443 [RST, ACK] Seq=2 Ack=26 Win=0 Len=0",49644,443,0
167,6.044229,3232281142,2902291547,TLSv1.2,132,Application Data,49399,443,1
168,6.044263,3232281142,2902291547,TLSv1.2,93,Application Data,49399,443,1
169,6.044282,3232281142,2902291547,TLSv1.2,277,Application Data,49399,443,1
170,6.045726,3232281089,3232281142,TCP,66,"53  >  49760 [SYN, ACK] Seq=0 Ack=1 Win=29200 Len=0 MSS=1460 SACK_PERM WS=32",53,49760,0
171,6.045726,3232281089,3232281142,TCP,66,"53  >  49761 [SYN, ACK] Seq=0 Ack=1 Win=29200 Len=0 MSS=1460 SACK_PERM WS=32",53,49761,0
172,6.045726,3232281089,3232281142,TCP,66,"53  >  49762 [SYN, ACK] Seq=0 Ack=1 Win=29200 Len=0 MSS=1460 SACK_PERM WS=32",53,49762,0
173,6.045726,3232281089,3232281142,TCP,66,"53  >  49763 [SYN, ACK] Seq=0 Ack=1 Win=29200 Len=0 MSS=1460 SACK_PERM WS=32",53,49763,0
174,6.045726,3232281089,3232281142,TCP,66,"53  >  49764 [SYN, ACK] Seq=0 Ack=1 Win=29200 Len=0 MSS=1460 SACK_PERM WS=32",53,49764,0
175,6.045726,3232281089,3232281142,TCP,66,"53  >  49765 [SYN, ACK] Seq=0 Ack=1 Win=29200 Len=0 MSS=1460 SACK_PERM WS=32",53,49765,0
176,6.046309,3232281142,3232281089,TCP,54,49760  >  53 [ACK] Seq=1 Ack=1 Win=131328 Len=0,49760,53,0
177,6.04635,3232281142,3232281089,TCP,54,49761  >  53 [ACK] Seq=1 Ack=1 Win=131328 Len=0,49761,53,0
178,6.046364,3232281142,3232281089,TCP,54,49762  >  53 [ACK] Seq=1 Ack=1 Win=131328 Len=0,49762,53,0
179,6.046378,3232281142,3232281089,TCP,54,49763  >  53 [ACK] Seq=1 Ack=1 Win=131328 Len=0,49763,53,0
180,6.046396,3232281142,3232281089,TCP,54,49764  >  53 [ACK] Seq=1 Ack=1 Win=131328 Len=0,49764,53,0
181,6.046412,3232281142,3232281089,TCP,54,49765  >  53 [ACK] Seq=1 Ack=1 Win=131328 Len=0,49765,53,0
182,6.046615,3512060511,3232281142,TCP,54,443  >  49342 [ACK] Seq=1 Ack=104 Win=303 Len=0,443,49342,0
183,6.046615,3512060511,3232281142,TLSv1.2,93,Application Data,443,49342,1
184,6.046843,3232281142,3232281089,TCP,56,"49760  >  53 [PSH, ACK] Seq=1 Ack=1 Win=131328 Len=2 [TCP segment of a reassembled PDU]",49760,53,0
185,6.04686,3232281142,3232281089,TCP,56,"49762  >  53 [PSH, ACK] Seq=1 Ack=1 Win=131328 Len=2 [TCP segment of a reassembled PDU]",49762,53,0
186,6.046875,3232281142,3232281089,TCP,56,"49761  >  53 [PSH, ACK] Seq=1 Ack=1 Win=131328 Len=2 [TCP segment of a reassembled PDU]",49761,53,0
187,6.046876,3232281142,3232281089,DNS,91,Standard query 0x5270 A www.ticketmaster.ie,49760,53,0
188,6.046894,3232281142,3232281089,DNS,86,Standard query 0xddb3 A uk.tmconst.com,49762,53,0
189,6.046902,3232281142,3232281089,TCP,56,"49763  >  53 [PSH, ACK] Seq=1 Ack=1 Win=131328 Len=2 [TCP segment of a reassembled PDU]",49763,53,0
190,6.046904,3232281142,3232281089,DNS,91,Standard query 0x7f10 HTTPS www.ticketmaster.ie,49761,53,0
191,6.046939,3232281142,3232281089,DNS,86,Standard query 0x9c6f HTTPS uk.tmconst.com,49763,53,0
192,6.047271,3232281142,3232281089,TCP,56,"49764  >  53 [PSH, ACK] Seq=1 Ack=1 Win=131328 Len=2 [TCP segment of a reassembled PDU]",49764,53,0
193,6.047283,3232281142,3232281089,DNS,89,Standard query 0x314b A cdn.cookielaw.org,49764,53,0
194,6.047419,3232281142,3232281089,TCP,56,"49765  >  53 [PSH, ACK] Seq=1 Ack=1 Win=131328 Len=2 [TCP segment of a reassembled PDU]",49765,53,0
195,6.047433,3232281142,3232281089,DNS,89,Standard query 0xe840 HTTPS cdn.cookielaw.org,49765,53,0
197,6.048832,3232281089,3232281142,TCP,54,53  >  49760 [ACK] Seq=1 Ack=3 Win=29216 Len=0,53,49760,0
198,6.048832,3232281089,3232281142,TCP,54,53  >  49760 [ACK] Seq=1 Ack=40 Win=29216 Len=0,53,49760,0
199,6.050062,3232281089,3232281142,TCP,54,53  >  49762 [ACK] Seq=1 Ack=3 Win=29216 Len=0,53,49762,0
200,6.050062,3232281089,3232281142,TCP,54,53  >  49761 [ACK] Seq=1 Ack=3 Win=29216 Len=0,53,49761,0
201,6.050062,3232281089,3232281142,TCP,54,53  >  49762 [ACK] Seq=1 Ack=35 Win=29216 Len=0,53,49762,0
202,6.050062,3232281089,3232281142,TCP,54,53  >  49761 [ACK] Seq=1 Ack=40 Win=29216 Len=0,53,49761,0
203,6.050062,3232281089,3232281142,TCP,54,53  >  49763 [ACK] Seq=1 Ack=3 Win=29216 Len=0,53,49763,0
204,6.050062,3232281089,3232281142,TCP,54,53  >  49763 [ACK] Seq=1 Ack=35 Win=29216 Len=0,53,49763,0
205,6.050062,3232281089,3232281142,TCP,54,53  >  49764 [ACK] Seq=1 Ack=3 Win=29216 Len=0,53,49764,0
206,6.050062,3232281089,3232281142,TCP,54,53  >  49764 [ACK] Seq=1 Ack=38 Win=29216 Len=0,53,49764,0
207,6.050062,3232281089,3232281142,TCP,54,53  >  49765 [ACK] Seq=1 Ack=3 Win=29216 Len=0,53,49765,0
208,6.050062,3232281089,3232281142,TCP,54,53  >  49765 [ACK] Seq=1 Ack=38 Win=29216 Len=0,53,49765,0
209,6.051196,3512060511,3232281142,TCP,54,443  >  49342 [ACK] Seq=40 Ack=215 Win=303 Len=0,443,49342,0
212,6.052309,60984449,3232281142,TCP,54,443  >  49604 [ACK] Seq=26 Ack=2 Win=131 Len=0,443,49604,0
213,6.052309,3232281089,3232281142,DNS,123,Standard query response 0x314b A cdn.cookielaw.org A 104.18.130.236 A 104.18.131.236,53,49764,0
214,6.052309,3232281089,3232281142,DNS,161,Standard query response 0xe840 HTTPS cdn.cookielaw.org HTTPS,53,49765,0
215,6.052309,2902291547,3232281142,TCP,54,443  >  49399 [ACK] Seq=1 Ack=79 Win=289 Len=0,443,49399,0
216,6.052309,2902291547,3232281142,TCP,54,443  >  49399 [ACK] Seq=1 Ack=118 Win=289 Len=0,443,49399,0
217,6.052309,2902291547,3232281142,TCP,54,443  >  49399 [ACK] Seq=1 Ack=341 Win=297 Len=0,443,49399,0
218,6.052309,2902291547,3232281142,TLSv1.2,93,Application Data,443,49399,1
220,6.05282,3232281142,3232281089,TCP,54,"49764  >  53 [FIN, ACK] Seq=38 Ack=70 Win=131328 Len=0",49764,53,0
221,6.053046,3232281142,3232281089,TCP,54,"49765  >  53 [FIN, ACK] Seq=38 Ack=108 Win=131072 Len=0",49765,53,0
222,6.053401,3232281142,1746043628,TCP,66,49768  >  443 [SYN] Seq=0 Win=64240 Len=0 MSS=1460 WS=256 SACK_PERM,49768,443,0
225,6.053691,3232281142,3232281089,TCP,66,49769  >  53 [SYN] Seq=0 Win=64240 Len=0 MSS=1460 WS=256 SACK_PERM,49769,53,0
226,6.053815,3232281142,3232281089,TCP,66,49770  >  53 [SYN] Seq=0 Win=64240 Len=0 MSS=1460 WS=256 SACK_PERM,49770,53,0
230,6.054447,3232281089,3232281142,TCP,54,"53  >  49764 [FIN, ACK] Seq=70 Ack=39 Win=29216 Len=0",53,49764,0
232,6.055043,3232281142,3232281089,TCP,54,49764  >  53 [ACK] Seq=39 Ack=71 Win=131328 Len=0,49764,53,0
235,6.055819,3232281089,3232281142,TCP,66,"53  >  49769 [SYN, ACK] Seq=0 Ack=1 Win=29200 Len=0 MSS=1460 SACK_PERM WS=32",53,49769,0
238,6.055933,3232281142,3232281089,TCP,54,49769  >  53 [ACK] Seq=1 Ack=1 Win=131328 Len=0,49769,53,0
239,6.056397,3232281142,3232281089,TCP,56,"49769  >  53 [PSH, ACK] Seq=1 Ack=1 Win=131328 Len=2 [TCP segment of a reassembled PDU]",49769,53,0
240,6.056409,3232281142,3232281089,DNS,92,Standard query 0x1e58 A epsf.ticketmaster.ie,49769,53,0
241,6.056812,3232281089,3232281142,TCP,54,"53  >  49765 [FIN, ACK] Seq=108 Ack=39 Win=29216 Len=0",53,49765,0
242,6.056812,3232281089,3232281142,TCP,66,"53  >  49770 [SYN, ACK] Seq=0 Ack=1 Win=29200 Len=0 MSS=1460 SACK_PERM WS=32",53,49770,0
245,6.056979,3232281142,3232281089,TCP,54,49770  >  53 [ACK] Seq=1 Ack=1 Win=131328 Len=0,49770,53,0
246,6.057129,3232281142,3232281089,TCP,54,49765  >  53 [ACK] Seq=39 Ack=109 Win=131072 Len=0,49765,53,0
247,6.057534,3232281142,3232281089,TCP,56,"49770  >  53 [PSH, ACK] Seq=1 Ack=1 Win=131328 Len=2 [TCP segment of a reassembled PDU]",49770,53,0
248,6.057553,3232281142,3232281089,DNS,92,Standard query 0x0183 HTTPS epsf.ticketmaster.ie,49770,53,0
249,6.058016,3232281089,3232281142,TCP,54,53  >  49769 [ACK] Seq=1 Ack=3 Win=29216 Len=0,53,49769,0
250,6.058016,3232281089,3232281142,TCP,54,53  >  49769 [ACK] Seq=1 Ack=41 Win=29216 Len=0,53,49769,0
251,6.059089,3232281089,3232281142,TCP,54,53  >  49770 [ACK] Seq=1 Ack=3 Win=29216 Len=0,53,49770,0
252,6.059089,3232281089,3232281142,TCP,54,53  >  49770 [ACK] Seq=1 Ack=41 Win=29216 Len=0,53,49770,0
255,6.062365,3232281089,3232281142,DNS,155,Standard query response 0xddb3 A uk.tmconst.com CNAME dualstack.ticketmaster.map.fastly.net A 199.232.26.87,53,49762,0
256,6.062365,3232281089,3232281142,DNS,197,Standard query response 0x9c6f HTTPS uk.tmconst.com CNAME dualstack.ticketmaster.map.fastly.net SOA ns1.fastly.net,53,49763,0
257,6.062365,3232281089,3232281142,DNS,155,Standard query response 0x5270 A www.ticketmaster.ie CNAME ticketmaster-intl.map.fastly.net A 199.232.26.87,53,49760,0
258,6.062654,3232281142,3232281089,TCP,54,"49763  >  53 [FIN, ACK] Seq=35 Ack=144 Win=131072 Len=0",49763,53,0
259,6.062741,3232281142,3232281089,TCP,54,"49762  >  53 [FIN, ACK] Seq=35 Ack=102 Win=131072 Len=0",49762,53,0
260,6.062777,3232281142,3232281089,TCP,54,"49760  >  53 [FIN, ACK] Seq=40 Ack=102 Win=131072 Len=0",49760,53,0
261,6.063079,3232281142,3232281089,TCP,66,49771  >  53 [SYN] Seq=0 Win=64240 Len=0 MSS=1460 WS=256 SACK_PERM,49771,53,0
262,6.063224,3232281142,3232281089,TCP,66,49772  >  53 [SYN] Seq=0 Win=64240 Len=0 MSS=1460 WS=256 SACK_PERM,49772,53,0
263,6.064809,3232281089,3232281142,DNS,200,Standard query response 0x7f10 HTTPS www.ticketmaster.ie CNAME ticketmaster-intl.map.fastly.net SOA ns1.fastly.net,53,49761,0
264,6.064809,1746043628,3232281142,TCP,66,"443  >  49768 [SYN, ACK] Seq=0 Ack=1 Win=64240 Len=0 MSS=1400 SACK_PERM WS=8192",443,49768,0
266,6.064809,3232281089,3232281142,TCP,66,"53  >  49771 [SYN, ACK] Seq=0 Ack=1 Win=29200 Len=0 MSS=1460 SACK_PERM WS=32",53,49771,0
267,6.064809,3232281089,3232281142,TCP,66,"53  >  49772 [SYN, ACK] Seq=0 Ack=1 Win=29200 Len=0 MSS=1460 SACK_PERM WS=32",53,49772,0
268,6.065172,3232281142,1746043628,TCP,54,49768  >  443 [ACK] Seq=1 Ack=1 Win=131584 Len=0,49768,443,0
269,6.06521,3232281142,3232281089,TCP,54,49771  >  53 [ACK] Seq=1 Ack=1 Win=131328 Len=0,49771,53,0
270,6.065218,3232281142,3232281089,TCP,54,49772  >  53 [ACK] Seq=1 Ack=1 Win=131328 Len=0,49772,53,0
271,6.065806,3232281142,3353877079,TCP,66,49773  >  443 [SYN] Seq=0 Win=64240 Len=0 MSS=1460 WS=256 SACK_PERM,49773,443,0
272,6.065942,3232281089,3232281142,TCP,54,"53  >  49763 [FIN, ACK] Seq=144 Ack=36 Win=29216 Len=0",53,49763,0
274,6.065942,3232281089,3232281142,TCP,54,"53  >  49760 [FIN, ACK] Seq=102 Ack=41 Win=29216 Len=0",53,49760,0
275,6.065942,3232281089,3232281142,TCP,54,"53  >  49762 [FIN, ACK] Seq=102 Ack=36 Win=29216 Len=0",53,49762,0
276,6.066184,3232281142,3232281089,TCP,56,"49771  >  53 [PSH, ACK] Seq=1 Ack=1 Win=131328 Len=2 [TCP segment of a reassembled PDU]",49771,53,0
277,6.066202,3232281142,3232281089,TCP,54,49763  >  53 [ACK] Seq=36 Ack=145 Win=131072 Len=0,49763,53,0
278,6.066202,3232281142,3232281089,TCP,66,49774  >  80 [SYN] Seq=0 Win=64240 Len=0 MSS=1460 WS=256 SACK_PERM,49774,80,0
279,6.066227,3232281142,3232281089,DNS,102,Standard query 0x9aa0 A 1362441.collect.igodigital.com,49771,53,0
280,6.066261,3232281142,3232281089,TCP,54,49762  >  53 [ACK] Seq=36 Ack=103 Win=131072 Len=0,49762,53,0
282,6.066345,3232281142,3232281089,TCP,54,49760  >  53 [ACK] Seq=41 Ack=103 Win=131072 Len=0,49760,53,0
284,6.066549,3232281142,3232281089,TCP,66,49775  >  53 [SYN] Seq=0 Win=64240 Len=0 MSS=1460 WS=256 SACK_PERM,49775,53,0
285,6.066647,3232281142,1746043628,TLSv1.3,591,Client Hello,49768,443,0
286,6.066657,3232281142,3232281089,TCP,66,49776  >  53 [SYN] Seq=0 Win=64240 Len=0 MSS=1460 WS=256 SACK_PERM,49776,53,0
287,6.066683,3232281142,3232281089,TCP,54,"49761  >  53 [FIN, ACK] Seq=40 Ack=147 Win=131072 Len=0",49761,53,0
288,6.066815,3232281142,3232281089,TCP,56,"49772  >  53 [PSH, ACK] Seq=1 Ack=1 Win=131328 Len=2 [TCP segment of a reassembled PDU]",49772,53,0
289,6.066833,3232281142,3232281089,DNS,102,Standard query 0x497d HTTPS 1362441.collect.igodigital.com,49772,53,0
290,6.067927,3232281089,3232281142,TCP,54,53  >  49771 [ACK] Seq=1 Ack=3 Win=29216 Len=0,53,49771,0
291,6.067927,3232281089,3232281142,TCP,54,53  >  49771 [ACK] Seq=1 Ack=51 Win=29216 Len=0,53,49771,0
292,6.067927,3232281089,3232281142,TCP,66,"80  >  49774 [SYN, ACK] Seq=0 Ack=1 Win=29200 Len=0 MSS=1460 SACK_PERM WS=32",80,49774,0
293,6.068071,3232281142,3232281089,TCP,54,49774  >  80 [ACK] Seq=1 Ack=1 Win=131328 Len=0,49774,80,0
294,6.068779,3232281142,580244451,TLSv1.2,454,Application Data,65451,443,1
295,6.068901,3232281142,3232281089,HTTP,273,GET /wpad.dat HTTP/1.1 ,49774,80,0
296,6.068913,3232281089,3232281142,TCP,54,53  >  49772 [ACK] Seq=1 Ack=3 Win=29216 Len=0,53,49772,0
297,6.068913,3232281089,3232281142,TCP,54,53  >  49772 [ACK] Seq=1 Ack=51 Win=29216 Len=0,53,49772,0
299,6.068913,3232281089,3232281142,TCP,66,"53  >  49775 [SYN, ACK] Seq=0 Ack=1 Win=29200 Len=0 MSS=1460 SACK_PERM WS=32",53,49775,0
300,6.069038,3232281142,3232281089,TCP,54,49775  >  53 [ACK] Seq=1 Ack=1 Win=131328 Len=0,49775,53,0
302,6.069593,3232281142,3232281089,TCP,56,"49775  >  53 [PSH, ACK] Seq=1 Ack=1 Win=131328 Len=2 [TCP segment of a reassembled PDU]",49775,53,0
303,6.069604,3232281142,3232281089,DNS,87,Standard query 0x14f9 A se.monetate.net,49775,53,0
304,6.070453,3232281089,3232281142,TCP,66,"53  >  49776 [SYN, ACK] Seq=0 Ack=1 Win=29200 Len=0 MSS=1460 SACK_PERM WS=32",53,49776,0
305,6.070453,3232281089,3232281142,TCP,54,80  >  49774 [ACK] Seq=1 Ack=220 Win=30272 Len=0,80,49774,0
306,6.07056,3232281142,3232281089,TCP,54,49776  >  53 [ACK] Seq=1 Ack=1 Win=131328 Len=0,49776,53,0
307,6.071164,3232281142,3232281089,TCP,56,"49776  >  53 [PSH, ACK] Seq=1 Ack=1 Win=131328 Len=2 [TCP segment of a reassembled PDU]",49776,53,0
308,6.071182,3232281142,3232281089,DNS,87,Standard query 0xcc22 HTTPS se.monetate.net,49776,53,0
309,6.071444,3232281089,3232281142,TCP,54,53  >  49775 [ACK] Seq=1 Ack=3 Win=29216 Len=0,53,49775,0
310,6.071444,3232281089,3232281142,TCP,54,53  >  49775 [ACK] Seq=1 Ack=36 Win=29216 Len=0,53,49775,0
311,6.072738,3353877079,3232281142,TCP,66,"443  >  49773 [SYN, ACK] Seq=0 Ack=1 Win=65535 Len=0 MSS=1452 SACK_PERM WS=512",443,49773,0
312,6.072738,3232281089,3232281142,TCP,54,53  >  49776 [ACK] Seq=1 Ack=3 Win=29216 Len=0,53,49776,0
313,6.072738,3232281089,3232281142,TCP,54,53  >  49776 [ACK] Seq=1 Ack=36 Win=29216 Len=0,53,49776,0
314,6.072738,3232281089,3232281142,TCP,163,"80  >  49774 [PSH, ACK] Seq=1 Ack=220 Win=30272 Len=109 [TCP segment of a reassembled PDU]",80,49774,0
315,6.072738,3232281089,3232281142,TCP,1514,80  >  49774 [ACK] Seq=110 Ack=220 Win=30272 Len=1460 [TCP segment of a reassembled PDU],80,49774,0
316,6.072982,3232281142,3353877079,TCP,54,49773  >  443 [ACK] Seq=1 Ack=1 Win=132096 Len=0,49773,443,0
317,6.073004,3232281142,3232281089,TCP,54,49774  >  80 [ACK] Seq=220 Ack=1570 Win=131328 Len=0,49774,80,0
318,6.073312,3232281142,3232281089,TCP,54,"49774  >  80 [FIN, ACK] Seq=220 Ack=1570 Win=131328 Len=0",49774,80,0
319,6.073861,3232281142,3353877079,TLSv1.2,318,Client Hello,49773,443,0
320,6.074852,3232281089,3232281142,HTTP,440,HTTP/1.1 400 Bad Request  (text/html),80,49774,0
321,6.07489,3232281142,3232281089,TCP,54,"49774  >  80 [RST, ACK] Seq=221 Ack=1956 Win=0 Len=0",49774,80,0
322,6.07599,1746043628,3232281142,TCP,54,443  >  49768 [ACK] Seq=1 Ack=538 Win=57344 Len=0,443,49768,0
323,6.07599,3232281089,3232281142,DNS,152,Standard query response 0x1e58 A epsf.ticketmaster.ie CNAME ticketmaster2.map.fastly.net A 199.232.26.87,53,49769,0
324,6.07599,3232281089,3232281142,DNS,197,Standard query response 0x0183 HTTPS epsf.ticketmaster.ie CNAME ticketmaster2.map.fastly.net SOA ns1.fastly.net,53,49770,0
325,6.076355,3232281142,3232281089,TCP,54,"49769  >  53 [FIN, ACK] Seq=41 Ack=99 Win=131072 Len=0",49769,53,0
326,6.076429,3232281142,3232281089,TCP,54,"49770  >  53 [FIN, ACK] Seq=41 Ack=144 Win=131072 Len=0",49770,53,0
327,6.076781,3232281142,3232281089,TCP,66,49777  >  53 [SYN] Seq=0 Win=64240 Len=0 MSS=1460 WS=256 SACK_PERM,49777,53,0
328,6.076902,3232281142,3232281089,TCP,66,49778  >  53 [SYN] Seq=0 Win=64240 Len=0 MSS=1460 WS=256 SACK_PERM,49778,53,0
329,6.076944,3232281089,3232281142,TCP,54,"53  >  49761 [FIN, ACK] Seq=147 Ack=41 Win=29216 Len=0",53,49761,0
330,6.077115,3232281142,3232281089,TCP,54,49761  >  53 [ACK] Seq=41 Ack=148 Win=131072 Len=0,49761,53,0
331,6.078266,3232281089,3232281142,DNS,283,Standard query response 0x9aa0 A 1362441.collect.igodigital.com CNAME nova.collect.igodigital.com CNAME nova-collector-1192479543.us-east-1.elb.amazonaws.com A 52.202.55.90 A 54.145.98.26 A 52.207.156.186 A 34.232.254.207 A 34.230.234.159 A 54.92.198.22,53,49771,0
332,6.078266,3353877079,3232281142,TCP,54,443  >  49773 [ACK] Seq=1 Ack=265 Win=147456 Len=0,443,49773,0
333,6.078266,3232281089,3232281142,TCP,66,"53  >  49777 [SYN, ACK] Seq=0 Ack=1 Win=29200 Len=0 MSS=1460 SACK_PERM WS=32",53,49777,0
334,6.078266,2902291547,3232281142,TLSv1.2,124,Application Data,443,49399,1
335,6.078266,3232281089,3232281142,TCP,66,"53  >  49778 [SYN, ACK] Seq=0 Ack=1 Win=29200 Len=0 MSS=1460 SACK_PERM WS=32",53,49778,0
336,6.078266,2902291547,3232281142,TLSv1.2,116,Application Data,443,49399,1
337,6.078266,2902291547,3232281142,TLSv1.2,85,Application Data,443,49399,1
338,6.078516,3232281142,3232281089,TCP,54,49777  >  53 [ACK] Seq=1 Ack=1 Win=131328 Len=0,49777,53,0
339,6.078533,3232281142,2902291547,TCP,54,49399  >  443 [ACK] Seq=341 Ack=203 Win=511 Len=0,49399,443,0
340,6.07854,3232281142,3232281089,TCP,54,49778  >  53 [ACK] Seq=1 Ack=1 Win=131328 Len=0,49778,53,0
341,6.079105,3232281142,2902291547,TLSv1.2,89,Application Data,49399,443,1
342,6.079111,3232281142,3232281089,TCP,54,"49771  >  53 [FIN, ACK] Seq=51 Ack=230 Win=131072 Len=0",49771,53,0
343,6.079115,3232281142,3232281089,TCP,56,"49777  >  53 [PSH, ACK] Seq=1 Ack=1 Win=131328 Len=2 [TCP segment of a reassembled PDU]",49777,53,0
344,6.079127,3232281142,3232281089,DNS,97,Standard query 0x25d2 A www.googletagservices.com,49777,53,0
345,6.079268,3232281142,3232281089,TCP,56,"49778  >  53 [PSH, ACK] Seq=1 Ack=1 Win=131328 Len=2 [TCP segment of a reassembled PDU]",49778,53,0
346,6.079285,3232281142,3232281089,DNS,97,Standard query 0xc175 HTTPS www.googletagservices.com,49778,53,0
347,6.080555,1746043628,3232281142,TLSv1.3,1506,"Server Hello, Change Cipher Spec",443,49768,0
348,6.080555,1746043628,3232281142,TLSv1.3,787,Application Data,443,49768,1
349,6.080555,2902291547,3232281142,TLSv1.2,93,Application Data,443,49399,1
350,6.080555,3232281089,3232281142,TCP,54,"53  >  49769 [FIN, ACK] Seq=99 Ack=42 Win=29216 Len=0",53,49769,0
351,6.080555,3232281089,3232281142,TCP,54,"53  >  49770 [FIN, ACK] Seq=144 Ack=42 Win=29216 Len=0",53,49770,0
352,6.080555,580244451,3232281142,TCP,54,443  >  65451 [ACK] Seq=1 Ack=401 Win=430 Len=0,443,65451,0
353,6.080555,3353877079,3232281142,TLSv1.2,1506,Server Hello,443,49773,0
354,6.080555,3353877079,3232281142,TCP,1506,443  >  49773 [ACK] Seq=1453 Ack=265 Win=147456 Len=1452 [TCP segment of a reassembled PDU],443,49773,0
355,6.080555,3353877079,3232281142,TCP,1506,443  >  49773 [ACK] Seq=2905 Ack=265 Win=147456 Len=1452 [TCP segment of a reassembled PDU],443,49773,0
356,6.080555,3353877079,3232281142,TLSv1.2,1048,"Certificate, Server Key Exchange, Server Hello Done",443,49773,0
357,6.080555,3232281089,3232281142,TCP,54,53  >  49777 [ACK] Seq=1 Ack=3 Win=29216 Len=0,53,49777,0
358,6.080555,3232281089,3232281142,TCP,54,53  >  49777 [ACK] Seq=1 Ack=46 Win=29216 Len=0,53,49777,0
359,6.080555,3232281089,3232281142,TCP,54,53  >  49778 [ACK] Seq=1 Ack=3 Win=29216 Len=0,53,49778,0
360,6.080555,3232281089,3232281142,TCP,54,53  >  49778 [ACK] Seq=1 Ack=46 Win=29216 Len=0,53,49778,0
361,6.080755,3232281142,1746043628,TCP,54,49768  >  443 [ACK] Seq=538 Ack=2186 Win=131584 Len=0,49768,443,0
362,6.080764,3232281142,2902291547,TLSv1.2,93,Application Data,49399,443,1
363,6.080784,3232281142,580244451,TLSv1.2,216,Application Data,65451,443,1
364,6.080794,3232281142,3353877079,TCP,54,49773  >  443 [ACK] Seq=265 Ack=5351 Win=132096 Len=0,49773,443,0
365,6.080959,3232281142,3232281089,TCP,54,49769  >  53 [ACK] Seq=42 Ack=100 Win=131072 Len=0,49769,53,0
366,6.081013,3232281142,3232281089,TCP,54,49770  >  53 [ACK] Seq=42 Ack=145 Win=131072 Len=0,49770,53,0
367,6.081341,3232281142,1746043628,TLSv1.3,118,"Change Cipher Spec, Application Data",49768,443,0
368,6.081813,3232281089,3232281142,DNS,163,Standard query response 0x25d2 A www.googletagservices.com A 209.85.202.155 A 209.85.202.157 A 209.85.202.156 A 209.85.202.154,53,49777,0
369,6.081813,3232281089,3232281142,DNS,156,Standard query response 0xc175 HTTPS www.googletagservices.com SOA ns1.google.com,53,49778,0
370,6.081813,3232281089,3232281142,DNS,269,Standard query response 0x497d HTTPS 1362441.collect.igodigital.com CNAME nova.collect.igodigital.com CNAME nova-collector-1192479543.us-east-1.elb.amazonaws.com SOA ns-1119.awsdns-11.org,53,49772,0
371,6.081865,3232281142,580244451,TLSv1.2,457,Application Data,65446,443,1
372,6.081957,3232281142,580244451,TCP,1466,65446  >  443 [ACK] Seq=404 Ack=1 Win=512 Len=1412 [TCP segment of a reassembled PDU],65446,443,0
373,6.081957,3232281142,580244451,TCP,1466,65446  >  443 [ACK] Seq=1816 Ack=1 Win=512 Len=1412 [TCP segment of a reassembled PDU],65446,443,0
374,6.081957,3232281142,580244451,TCP,1466,65446  >  443 [ACK] Seq=3228 Ack=1 Win=512 Len=1412 [TCP segment of a reassembled PDU],65446,443,0
375,6.081957,3232281142,580244451,TCP,1466,65446  >  443 [ACK] Seq=4640 Ack=1 Win=512 Len=1412 [TCP segment of a reassembled PDU],65446,443,0
376,6.081957,3232281142,580244451,TCP,1466,65446  >  443 [ACK] Seq=6052 Ack=1 Win=512 Len=1412 [TCP segment of a reassembled PDU],65446,443,0
377,6.081957,3232281142,580244451,TLSv1.2,1227,Application Data,65446,443,1
378,6.082125,3232281142,3232281089,TCP,54,"49778  >  53 [FIN, ACK] Seq=46 Ack=103 Win=131072 Len=0",49778,53,0
379,6.0822,3232281142,3232281089,TCP,54,"49772  >  53 [FIN, ACK] Seq=51 Ack=216 Win=131072 Len=0",49772,53,0
380,6.082484,3232281142,3232281089,TCP,66,49779  >  53 [SYN] Seq=0 Win=64240 Len=0 MSS=1460 WS=256 SACK_PERM,49779,53,0
381,6.082607,3232281142,3232281089,TCP,66,49780  >  53 [SYN] Seq=0 Win=64240 Len=0 MSS=1460 WS=256 SACK_PERM,49780,53,0
382,6.082947,3232281089,3232281142,TCP,54,"53  >  49771 [FIN, ACK] Seq=230 Ack=52 Win=29216 Len=0",53,49771,0
383,6.0832,3232281142,3232281089,TCP,54,49771  >  53 [ACK] Seq=52 Ack=231 Win=131072 Len=0,49771,53,0
384,6.084875,3232281089,3232281142,TCP,66,"53  >  49779 [SYN, ACK] Seq=0 Ack=1 Win=29200 Len=0 MSS=1460 SACK_PERM WS=32",53,49779,0
385,6.084875,3232281089,3232281142,TCP,66,"53  >  49780 [SYN, ACK] Seq=0 Ack=1 Win=29200 Len=0 MSS=1460 SACK_PERM WS=32",53,49780,0
386,6.084875,3232281089,3232281142,TCP,54,"53  >  49778 [FIN, ACK] Seq=103 Ack=47 Win=29216 Len=0",53,49778,0
387,6.085091,3232281142,3232281089,TCP,54,49779  >  53 [ACK] Seq=1 Ack=1 Win=131328 Len=0,49779,53,0
388,6.085114,3232281142,3232281089,TCP,54,49780  >  53 [ACK] Seq=1 Ack=1 Win=131328 Len=0,49780,53,0
389,6.085255,3232281142,3232281089,TCP,54,49778  >  53 [ACK] Seq=47 Ack=104 Win=131072 Len=0,49778,53,0
390,6.085773,3232281142,3232281089,TCP,56,"49779  >  53 [PSH, ACK] Seq=1 Ack=1 Win=131328 Len=2 [TCP segment of a reassembled PDU]",49779,53,0
391,6.085789,3232281142,3232281089,TCP,56,"49780  >  53 [PSH, ACK] Seq=1 Ack=1 Win=131328 Len=2 [TCP segment of a reassembled PDU]",49780,53,0
392,6.085795,3232281142,3232281089,DNS,89,Standard query 0x5362 A cdn.permutive.com,49779,53,0
393,6.085811,3232281142,3232281089,DNS,89,Standard query 0xfd8c HTTPS cdn.permutive.com,49780,53,0
394,6.085871,3232281089,3232281142,TCP,54,"53  >  49772 [FIN, ACK] Seq=216 Ack=52 Win=29216 Len=0",53,49772,0
395,6.085871,2817227836,3232281142,TCP,54,443  >  49649 [ACK] Seq=26 Ack=2 Win=165 Len=0,443,49649,0
396,6.085871,2817227836,3232281142,TCP,54,443  >  49650 [ACK] Seq=26 Ack=2 Win=165 Len=0,443,49650,0
397,6.085871,2817227836,3232281142,TCP,54,443  >  49644 [ACK] Seq=26 Ack=2 Win=165 Len=0,443,49644,0
398,6.085871,580244451,3232281142,TCP,54,443  >  65451 [ACK] Seq=1 Ack=563 Win=441 Len=0,443,65451,0
399,6.085931,3232281142,2817227836,TCP,54,49649  >  443 [RST] Seq=2 Win=0 Len=0,49649,443,0
400,6.085947,3232281142,2817227836,TCP,54,49650  >  443 [RST] Seq=2 Win=0 Len=0,49650,443,0
401,6.085955,3232281142,2817227836,TCP,54,49644  >  443 [RST] Seq=2 Win=0 Len=0,49644,443,0
402,6.086101,3232281142,3232281089,TCP,54,49772  >  53 [ACK] Seq=52 Ack=217 Win=131072 Len=0,49772,53,0
403,6.087178,2902291547,3232281142,TCP,54,443  >  49399 [ACK] Seq=242 Ack=415 Win=297 Len=0,443,49399,0
404,6.087178,3232281089,3232281142,TCP,54,53  >  49779 [ACK] Seq=1 Ack=3 Win=29216 Len=0,53,49779,0
405,6.087178,3232281089,3232281142,TCP,54,53  >  49780 [ACK] Seq=1 Ack=3 Win=29216 Len=0,53,49780,0
406,6.087178,3232281089,3232281142,TCP,54,53  >  49780 [ACK] Seq=1 Ack=38 Win=29216 Len=0,53,49780,0
407,6.087178,3232281089,3232281142,TCP,54,53  >  49779 [ACK] Seq=1 Ack=38 Win=29216 Len=0,53,49779,0
408,6.088303,3232281089,3232281142,DNS,123,Standard query response 0x5362 A cdn.permutive.com A 104.17.118.17 A 104.17.119.17,53,49779,0
409,6.088303,3232281089,3232281142,DNS,161,Standard query response 0xfd8c HTTPS cdn.permutive.com HTTPS,53,49780,0
410,6.088303,580244451,3232281142,TCP,54,443  >  65446 [ACK] Seq=1 Ack=1816 Win=405 Len=0,443,65446,0
411,6.088303,580244451,3232281142,TCP,54,443  >  65446 [ACK] Seq=1 Ack=4640 Win=427 Len=0,443,65446,0
412,6.088303,580244451,3232281142,TCP,54,443  >  65446 [ACK] Seq=1 Ack=7464 Win=449 Len=0,443,65446,0
413,6.088646,3232281142,3232281089,TCP,54,"49779  >  53 [FIN, ACK] Seq=38 Ack=70 Win=131328 Len=0",49779,53,0
414,6.088746,3232281142,3232281089,TCP,54,"49780  >  53 [FIN, ACK] Seq=38 Ack=108 Win=131072 Len=0",49780,53,0
415,6.089192,3232281142,3232281089,TCP,66,49781  >  53 [SYN] Seq=0 Win=64240 Len=0 MSS=1460 WS=256 SACK_PERM,49781,53,0
416,6.089331,3232281142,3232281089,TCP,66,49782  >  53 [SYN] Seq=0 Win=64240 Len=0 MSS=1460 WS=256 SACK_PERM,49782,53,0
417,6.089381,1746043628,3232281142,TLSv1.3,566,"Application Data, Application Data",443,49768,0
418,6.090611,3232281089,3232281142,TCP,54,"53  >  49779 [FIN, ACK] Seq=70 Ack=39 Win=29216 Len=0",53,49779,0
419,6.090611,3232281089,3232281142,TCP,66,"53  >  49781 [SYN, ACK] Seq=0 Ack=1 Win=29200 Len=0 MSS=1460 SACK_PERM WS=32",53,49781,0
420,6.090611,3232281089,3232281142,TCP,66,"53  >  49782 [SYN, ACK] Seq=0 Ack=1 Win=29200 Len=0 MSS=1460 SACK_PERM WS=32",53,49782,0
421,6.090611,3232281089,3232281142,TCP,54,"53  >  49780 [FIN, ACK] Seq=108 Ack=39 Win=29216 Len=0",53,49780,0
422,6.090839,3232281142,3232281089,TCP,54,49779  >  53 [ACK] Seq=39 Ack=71 Win=131328 Len=0,49779,53,0
423,6.090863,3232281142,3232281089,TCP,54,49781  >  53 [ACK] Seq=1 Ack=1 Win=131328 Len=0,49781,53,0
424,6.090884,3232281142,3232281089,TCP,54,49782  >  53 [ACK] Seq=1 Ack=1 Win=131328 Len=0,49782,53,0
425,6.090974,3232281142,3512060511,TCP,54,49342  >  443 [ACK] Seq=215 Ack=40 Win=508 Len=0,49342,443,0
426,6.091029,3232281142,3232281089,TCP,54,49780  >  53 [ACK] Seq=39 Ack=109 Win=131072 Len=0,49780,53,0
427,6.091459,3232281142,3232281089,TCP,56,"49782  >  53 [PSH, ACK] Seq=1 Ack=1 Win=131328 Len=2 [TCP segment of a reassembled PDU]",49782,53,0
428,6.091476,3232281142,3232281089,DNS,102,Standard query 0xc2a9 HTTPS securepubads.g.doubleclick.net,49782,53,0
429,6.092771,580244451,3232281142,TCP,54,443  >  65446 [ACK] Seq=1 Ack=8637 Win=460 Len=0,443,65446,0
