No.,Time,Source,Destination,Protocol,Length,Info,Source Port,Destination Port
2,0.133314,192.168.178.54,172.253.116.95,TCP,55,49445  >  443 [ACK] Seq=1 Ack=1 Win=507 Len=1 [TCP segment of a reassembled PDU],49445,443
3,0.13944,172.253.116.95,192.168.178.54,TCP,66,443  >  49445 [ACK] Seq=1 Ack=2 Win=278 Len=0 SLE=1 SRE=2,443,49445
5,0.204968,192.168.178.48,255.255.255.255,UDP,56,60048  >  3289 Len=14,60048,3289
7,0.77774,74.125.193.95,192.168.178.54,TLSv1.2,139,Application Data,443,49196
8,0.77774,74.125.193.95,192.168.178.54,TLSv1.2,85,Application Data,443,49196
9,0.77774,74.125.193.95,192.168.178.54,TLSv1.2,93,Application Data,443,49196
10,0.777844,192.168.178.54,74.125.193.95,TCP,54,49196  >  443 [ACK] Seq=1 Ack=156 Win=509 Len=0,49196,443
11,0.77805,192.168.178.54,74.125.193.95,TLSv1.2,89,Application Data,49196,443
12,0.778084,192.168.178.54,74.125.193.95,TLSv1.2,93,Application Data,49196,443
13,0.784545,74.125.193.95,192.168.178.54,TCP,54,443  >  49196 [ACK] Seq=156 Ack=36 Win=430 Len=0,443,49196
14,0.784545,74.125.193.95,192.168.178.54,TCP,54,443  >  49196 [ACK] Seq=156 Ack=75 Win=430 Len=0,443,49196
15,0.794483,192.168.178.54,74.125.193.95,TLSv1.2,284,Application Data,49195,443
16,0.794526,192.168.178.54,74.125.193.95,TLSv1.2,93,Application Data,49195,443
17,0.800719,74.125.193.95,192.168.178.54,TCP,54,443  >  49195 [ACK] Seq=1 Ack=270 Win=322 Len=0,443,49195
18,0.800719,74.125.193.95,192.168.178.54,TLSv1.2,93,Application Data,443,49195
19,0.841252,192.168.178.54,74.125.193.95,TCP,54,49195  >  443 [ACK] Seq=270 Ack=40 Win=512 Len=0,49195,443
20,0.90171,74.125.193.95,192.168.178.54,TLSv1.2,123,Application Data,443,49195
21,0.90171,74.125.193.95,192.168.178.54,TLSv1.2,85,Application Data,443,49195
22,0.901807,192.168.178.54,74.125.193.95,TCP,54,49195  >  443 [ACK] Seq=270 Ack=140 Win=511 Len=0,49195,443
23,0.903084,192.168.178.54,74.125.193.95,TCP,1466,49196  >  443 [ACK] Seq=75 Ack=156 Win=509 Len=1412 [TCP segment of a reassembled PDU],49196,443
24,0.903084,192.168.178.54,74.125.193.95,TCP,1466,49196  >  443 [ACK] Seq=1487 Ack=156 Win=509 Len=1412 [TCP segment of a reassembled PDU],49196,443
25,0.903084,192.168.178.54,74.125.193.95,TLSv1.2,191,Application Data,49196,443
26,0.90596,74.125.193.95,192.168.178.54,TLSv1.2,93,Application Data,443,49195
27,0.906386,192.168.178.54,74.125.193.95,TLSv1.2,93,Application Data,49195,443
28,0.909144,74.125.193.95,192.168.178.54,TCP,54,443  >  49196 [ACK] Seq=156 Ack=1487 Win=441 Len=0,443,49196
29,0.909144,74.125.193.95,192.168.178.54,TCP,54,443  >  49196 [ACK] Seq=156 Ack=2899 Win=452 Len=0,443,49196
30,0.909144,74.125.193.95,192.168.178.54,TCP,54,443  >  49196 [ACK] Seq=156 Ack=3036 Win=463 Len=0,443,49196
31,0.917087,74.125.193.95,192.168.178.54,TCP,54,443  >  49195 [ACK] Seq=179 Ack=309 Win=322 Len=0,443,49195
32,1.006532,74.125.193.95,192.168.178.54,TLSv1.2,121,Application Data,443,49196
33,1.006532,74.125.193.95,192.168.178.54,TLSv1.2,103,Application Data,443,49196
34,1.006588,192.168.178.54,74.125.193.95,TCP,54,49196  >  443 [ACK] Seq=3036 Ack=272 Win=509 Len=0,49196,443
38,1.742761,0.0.0.0,255.255.255.255,DHCP,590,DHCP Discover - Transaction ID 0x66ecf19c,68,67
39,1.742761,192.168.178.1,255.255.255.255,DHCP,590,DHCP Offer    - Transaction ID 0x66ecf19c,67,68
40,2.12483,140.82.113.26,192.168.178.54,TLSv1.2,79,Application Data,443,65140
41,2.125582,192.168.178.54,140.82.113.26,TLSv1.2,83,Application Data,65140,443
42,2.21556,140.82.113.26,192.168.178.54,TCP,54,443  >  65140 [ACK] Seq=26 Ack=30 Win=70 Len=0,443,65140
43,2.764926,192.168.178.24,192.168.178.255,UDP,77,41085  >  15600 Len=35,41085,15600
48,3.275037,192.168.178.54,209.85.202.105,TLSv1.2,1404,"Application Data, Application Data",49338,443
49,3.275101,192.168.178.54,209.85.202.105,TLSv1.2,93,Application Data,49338,443
54,3.282083,209.85.202.105,192.168.178.54,TCP,54,443  >  49338 [ACK] Seq=1 Ack=1351 Win=6419 Len=0,443,49338
55,3.282083,209.85.202.105,192.168.178.54,TCP,54,443  >  49338 [ACK] Seq=1 Ack=1390 Win=6419 Len=0,443,49338
56,3.282083,209.85.202.105,192.168.178.54,TLSv1.2,93,Application Data,443,49338
57,3.282784,192.168.178.54,209.85.202.105,TLSv1.2,1466,Application Data,49338,443
58,3.282784,192.168.178.54,209.85.202.105,TLSv1.2,147,Application Data,49338,443
59,3.289538,209.85.202.105,192.168.178.54,TCP,54,443  >  49338 [ACK] Seq=40 Ack=2895 Win=6430 Len=0,443,49338
60,3.300385,192.168.178.54,209.85.202.105,TLSv1.2,1453,"Application Data, Application Data",49338,443
61,3.309705,209.85.202.105,192.168.178.54,TLSv1.2,343,Application Data,443,49338
62,3.309705,209.85.202.105,192.168.178.54,TLSv1.2,108,Application Data,443,49338
63,3.309847,192.168.178.54,209.85.202.105,TCP,54,49338  >  443 [ACK] Seq=4294 Ack=383 Win=2469 Len=0,49338,443
64,3.310974,209.85.202.105,192.168.178.54,TLSv1.2,85,Application Data,443,49338
65,3.310974,209.85.202.105,192.168.178.54,TLSv1.2,93,Application Data,443,49338
66,3.311034,192.168.178.54,209.85.202.105,TCP,54,49338  >  443 [ACK] Seq=4294 Ack=453 Win=2469 Len=0,49338,443
67,3.311682,192.168.178.54,209.85.202.105,TLSv1.2,93,Application Data,49338,443
68,3.312555,192.168.178.54,209.85.202.105,TLSv1.2,89,Application Data,49338,443
69,3.318444,209.85.202.105,192.168.178.54,TCP,54,443  >  49338 [ACK] Seq=453 Ack=4368 Win=6441 Len=0,443,49338
70,3.335486,209.85.202.105,192.168.178.54,TLSv1.2,314,Application Data,443,49338
71,3.335486,209.85.202.105,192.168.178.54,TLSv1.2,118,Application Data,443,49338
72,3.335486,209.85.202.105,192.168.178.54,TLSv1.2,85,Application Data,443,49338
73,3.335486,209.85.202.105,192.168.178.54,TLSv1.2,93,Application Data,443,49338
74,3.335689,192.168.178.54,209.85.202.105,TCP,54,49338  >  443 [ACK] Seq=4368 Ack=847 Win=2467 Len=0,49338,443
75,3.337247,192.168.178.54,209.85.202.105,TLSv1.2,93,Application Data,49338,443
76,3.340133,209.85.202.105,192.168.178.54,TLSv1.2,438,Application Data,443,49338
77,3.340133,209.85.202.105,192.168.178.54,TLSv1.2,1466,Application Data,443,49338
78,3.340133,209.85.202.105,192.168.178.54,TLSv1.2,1466,Application Data,443,49338
79,3.340133,209.85.202.105,192.168.178.54,TLSv1.2,85,Application Data,443,49338
80,3.340133,209.85.202.105,192.168.178.54,TLSv1.2,217,Application Data,443,49338
81,3.340212,192.168.178.54,209.85.202.105,TCP,54,49338  >  443 [ACK] Seq=4407 Ack=4249 Win=2471 Len=0,49338,443
82,3.342493,209.85.202.105,192.168.178.54,TLSv1.2,1466,Application Data,443,49338
83,3.342493,209.85.202.105,192.168.178.54,TLSv1.2,1466,Application Data,443,49338
84,3.342493,209.85.202.105,192.168.178.54,TLSv1.2,1466,Application Data,443,49338
85,3.342493,209.85.202.105,192.168.178.54,TLSv1.2,1466,Application Data,443,49338
86,3.342493,209.85.202.105,192.168.178.54,TLSv1.2,1466,Application Data,443,49338
87,3.342493,209.85.202.105,192.168.178.54,TLSv1.2,1466,Application Data,443,49338
88,3.342493,209.85.202.105,192.168.178.54,TLSv1.2,1466,Application Data,443,49338
89,3.342493,209.85.202.105,192.168.178.54,TLSv1.2,1466,Application Data,443,49338
90,3.342493,209.85.202.105,192.168.178.54,TLSv1.2,1466,Application Data,443,49338
91,3.342493,209.85.202.105,192.168.178.54,TLSv1.2,1466,Application Data,443,49338
92,3.342493,209.85.202.105,192.168.178.54,TLSv1.2,1466,Application Data,443,49338
93,3.342493,209.85.202.105,192.168.178.54,TLSv1.2,1179,Application Data,443,49338
94,3.342493,209.85.202.105,192.168.178.54,TLSv1.2,1466,Application Data,443,49338
95,3.342493,209.85.202.105,192.168.178.54,TLSv1.2,1466,Application Data,443,49338
96,3.342493,209.85.202.105,192.168.178.54,TLSv1.2,1466,Application Data,443,49338
97,3.342493,209.85.202.105,192.168.178.54,TLSv1.2,1466,Application Data,443,49338
98,3.342493,209.85.202.105,192.168.178.54,TLSv1.2,1466,Application Data,443,49338
99,3.342493,209.85.202.105,192.168.178.54,TLSv1.2,1466,Application Data,443,49338
100,3.342493,209.85.202.105,192.168.178.54,TLSv1.2,1466,Application Data,443,49338
101,3.342493,209.85.202.105,192.168.178.54,TLSv1.2,1466,Application Data,443,49338
102,3.342493,209.85.202.105,192.168.178.54,TLSv1.2,1466,Application Data,443,49338
103,3.342493,209.85.202.105,192.168.178.54,TLSv1.2,1466,Application Data,443,49338
104,3.342493,209.85.202.105,192.168.178.54,TLSv1.2,1466,Application Data,443,49338
105,3.342493,209.85.202.105,192.168.178.54,TLSv1.2,1179,Application Data,443,49338
106,3.342493,209.85.202.105,192.168.178.54,TLSv1.2,1466,Application Data,443,49338
107,3.342493,209.85.202.105,192.168.178.54,TLSv1.2,1466,Application Data,443,49338
108,3.342493,209.85.202.105,192.168.178.54,TLSv1.2,638,Application Data,443,49338
109,3.342493,209.85.202.105,192.168.178.54,TLSv1.2,85,Application Data,443,49338
110,3.342804,192.168.178.54,209.85.202.105,TCP,54,49338  >  443 [ACK] Seq=4407 Ack=41002 Win=2471 Len=0,49338,443
111,3.347598,209.85.202.105,192.168.178.54,TCP,54,443  >  49338 [ACK] Seq=41002 Ack=4407 Win=6441 Len=0,443,49338
112,3.732052,3.162.140.129,192.168.178.54,TLSv1.2,78,Application Data,443,49604
113,3.732052,3.162.140.129,192.168.178.54,TCP,54,"443  >  49604 [FIN, ACK] Seq=25 Ack=1 Win=131 Len=0",443,49604
114,3.732159,192.168.178.54,3.162.140.129,TCP,54,49604  >  443 [ACK] Seq=1 Ack=26 Win=514 Len=0,49604,443
116,3.850671,2.18.24.18,192.168.178.54,TCP,54,"80  >  50590 [FIN, ACK] Seq=1 Ack=1 Win=501 Len=0",80,50590
117,3.850671,2.18.24.18,192.168.178.54,TCP,54,"80  >  50593 [FIN, ACK] Seq=1 Ack=1 Win=501 Len=0",80,50593
118,3.850671,2.18.24.18,192.168.178.54,TCP,54,"80  >  50591 [FIN, ACK] Seq=1 Ack=1 Win=501 Len=0",80,50591
119,3.850743,192.168.178.54,2.18.24.18,TCP,54,50590  >  80 [RST] Seq=1 Win=0 Len=0,50590,80
120,3.850815,192.168.178.54,2.18.24.18,TCP,54,50593  >  80 [RST] Seq=1 Win=0 Len=0,50593,80
121,3.850824,192.168.178.54,2.18.24.18,TCP,54,50591  >  80 [RST] Seq=1 Win=0 Len=0,50591,80
122,3.859619,2.18.24.18,192.168.178.54,TCP,54,"80  >  50592 [FIN, ACK] Seq=1 Ack=1 Win=501 Len=0",80,50592
123,3.859652,192.168.178.54,2.18.24.18,TCP,54,50592  >  80 [RST] Seq=1 Win=0 Len=0,50592,80
124,4.362804,167.235.124.60,192.168.178.54,TLSv1.2,78,Application Data,443,49644
125,4.362804,167.235.124.60,192.168.178.54,TCP,54,"443  >  49644 [FIN, ACK] Seq=25 Ack=1 Win=165 Len=0",443,49644
126,4.362901,192.168.178.54,167.235.124.60,TCP,54,49644  >  443 [ACK] Seq=1 Ack=26 Win=512 Len=0,49644,443
127,4.495666,167.235.124.60,192.168.178.54,TLSv1.2,78,Application Data,443,49649
128,4.495666,167.235.124.60,192.168.178.54,TCP,54,"443  >  49649 [FIN, ACK] Seq=25 Ack=1 Win=165 Len=0",443,49649
129,4.495742,192.168.178.54,167.235.124.60,TCP,54,49649  >  443 [ACK] Seq=1 Ack=26 Win=513 Len=0,49649,443
130,4.540755,167.235.124.60,192.168.178.54,TLSv1.2,78,Application Data,443,49650
131,4.540755,167.235.124.60,192.168.178.54,TCP,54,"443  >  49650 [FIN, ACK] Seq=25 Ack=1 Win=165 Len=0",443,49650
132,4.541008,192.168.178.54,167.235.124.60,TCP,54,49650  >  443 [ACK] Seq=1 Ack=26 Win=512 Len=0,49650,443
133,4.727076,23.37.1.115,192.168.178.54,TLSv1.2,85,Encrypted Alert,443,50605
134,4.727076,23.37.1.115,192.168.178.54,TCP,54,"443  >  50605 [FIN, ACK] Seq=32 Ack=1 Win=501 Len=0",443,50605
135,4.727133,192.168.178.54,23.37.1.115,TCP,54,50605  >  443 [RST] Seq=1 Win=0 Len=0,50605,443
136,4.727171,192.168.178.54,23.37.1.115,TCP,54,50605  >  443 [RST] Seq=1 Win=0 Len=0,50605,443
137,4.966237,23.200.105.143,192.168.178.54,TLSv1.2,85,Encrypted Alert,443,50604
138,4.966237,23.200.105.143,192.168.178.54,TCP,54,"443  >  50604 [FIN, ACK] Seq=32 Ack=1 Win=501 Len=0",443,50604
139,4.966372,192.168.178.54,23.200.105.143,TCP,54,50604  >  443 [RST] Seq=1 Win=0 Len=0,50604,443
140,4.966473,192.168.178.54,23.200.105.143,TCP,54,50604  >  443 [RST] Seq=1 Win=0 Len=0,50604,443
144,5.69127,192.168.178.24,239.255.255.250,UDP,77,35247  >  15600 Len=35,35247,15600
146,5.957925,23.48.165.19,192.168.178.54,TLSv1.2,85,Encrypted Alert,443,50617
147,5.957925,23.48.165.19,192.168.178.54,TCP,54,"443  >  50617 [FIN, ACK] Seq=32 Ack=1 Win=501 Len=0",443,50617
148,5.958059,192.168.178.54,23.48.165.19,TCP,54,50617  >  443 [RST] Seq=1 Win=0 Len=0,50617,443
149,5.958166,192.168.178.54,23.48.165.19,TCP,54,50617  >  443 [RST] Seq=1 Win=0 Len=0,50617,443
150,6.039241,192.168.178.54,209.85.202.95,TLSv1.2,118,Application Data,49342,443
151,6.03932,192.168.178.54,209.85.202.95,TLSv1.2,93,Application Data,49342,443
152,6.039341,192.168.178.54,209.85.202.95,TLSv1.2,165,Application Data,49342,443
154,6.040366,192.168.178.54,192.168.178.1,TCP,66,49760  >  53 [SYN] Seq=0 Win=64240 Len=0 MSS=1460 WS=256 SACK_PERM,49760,53
155,6.040596,192.168.178.54,192.168.178.1,TCP,66,49761  >  53 [SYN] Seq=0 Win=64240 Len=0 MSS=1460 WS=256 SACK_PERM,49761,53
156,6.040789,192.168.178.54,192.168.178.1,TCP,66,49762  >  53 [SYN] Seq=0 Win=64240 Len=0 MSS=1460 WS=256 SACK_PERM,49762,53
157,6.040909,192.168.178.54,192.168.178.1,TCP,66,49763  >  53 [SYN] Seq=0 Win=64240 Len=0 MSS=1460 WS=256 SACK_PERM,49763,53
158,6.041075,192.168.178.54,192.168.178.1,TCP,66,49764  >  53 [SYN] Seq=0 Win=64240 Len=0 MSS=1460 WS=256 SACK_PERM,49764,53
159,6.041179,192.168.178.54,192.168.178.1,TCP,66,49765  >  53 [SYN] Seq=0 Win=64240 Len=0 MSS=1460 WS=256 SACK_PERM,49765,53
160,6.043612,192.168.178.54,167.235.124.60,TCP,54,"49649  >  443 [FIN, ACK] Seq=1 Ack=26 Win=513 Len=0",49649,443
161,6.043663,192.168.178.54,167.235.124.60,TCP,54,"49649  >  443 [RST, ACK] Seq=2 Ack=26 Win=0 Len=0",49649,443
162,6.043787,192.168.178.54,3.162.140.129,TCP,54,"49604  >  443 [FIN, ACK] Seq=1 Ack=26 Win=514 Len=0",49604,443
163,6.043853,192.168.178.54,167.235.124.60,TCP,54,"49650  >  443 [FIN, ACK] Seq=1 Ack=26 Win=512 Len=0",49650,443
164,6.043874,192.168.178.54,167.235.124.60,TCP,54,"49650  >  443 [RST, ACK] Seq=2 Ack=26 Win=0 Len=0",49650,443
165,6.043997,192.168.178.54,167.235.124.60,TCP,54,"49644  >  443 [FIN, ACK] Seq=1 Ack=26 Win=512 Len=0",49644,443
166,6.044017,192.168.178.54,167.235.124.60,TCP,54,"49644  >  443 [RST, ACK] Seq=2 Ack=26 Win=0 Len=0",49644,443
167,6.044229,192.168.178.54,172.253.116.91,TLSv1.2,132,Application Data,49399,443
168,6.044263,192.168.178.54,172.253.116.91,TLSv1.2,93,Application Data,49399,443
169,6.044282,192.168.178.54,172.253.116.91,TLSv1.2,277,Application Data,49399,443
170,6.045726,192.168.178.1,192.168.178.54,TCP,66,"53  >  49760 [SYN, ACK] Seq=0 Ack=1 Win=29200 Len=0 MSS=1460 SACK_PERM WS=32",53,49760
171,6.045726,192.168.178.1,192.168.178.54,TCP,66,"53  >  49761 [SYN, ACK] Seq=0 Ack=1 Win=29200 Len=0 MSS=1460 SACK_PERM WS=32",53,49761
172,6.045726,192.168.178.1,192.168.178.54,TCP,66,"53  >  49762 [SYN, ACK] Seq=0 Ack=1 Win=29200 Len=0 MSS=1460 SACK_PERM WS=32",53,49762
173,6.045726,192.168.178.1,192.168.178.54,TCP,66,"53  >  49763 [SYN, ACK] Seq=0 Ack=1 Win=29200 Len=0 MSS=1460 SACK_PERM WS=32",53,49763
174,6.045726,192.168.178.1,192.168.178.54,TCP,66,"53  >  49764 [SYN, ACK] Seq=0 Ack=1 Win=29200 Len=0 MSS=1460 SACK_PERM WS=32",53,49764
175,6.045726,192.168.178.1,192.168.178.54,TCP,66,"53  >  49765 [SYN, ACK] Seq=0 Ack=1 Win=29200 Len=0 MSS=1460 SACK_PERM WS=32",53,49765
176,6.046309,192.168.178.54,192.168.178.1,TCP,54,49760  >  53 [ACK] Seq=1 Ack=1 Win=131328 Len=0,49760,53
177,6.04635,192.168.178.54,192.168.178.1,TCP,54,49761  >  53 [ACK] Seq=1 Ack=1 Win=131328 Len=0,49761,53
178,6.046364,192.168.178.54,192.168.178.1,TCP,54,49762  >  53 [ACK] Seq=1 Ack=1 Win=131328 Len=0,49762,53
179,6.046378,192.168.178.54,192.168.178.1,TCP,54,49763  >  53 [ACK] Seq=1 Ack=1 Win=131328 Len=0,49763,53
180,6.046396,192.168.178.54,192.168.178.1,TCP,54,49764  >  53 [ACK] Seq=1 Ack=1 Win=131328 Len=0,49764,53
181,6.046412,192.168.178.54,192.168.178.1,TCP,54,49765  >  53 [ACK] Seq=1 Ack=1 Win=131328 Len=0,49765,53
182,6.046615,209.85.202.95,192.168.178.54,TCP,54,443  >  49342 [ACK] Seq=1 Ack=104 Win=303 Len=0,443,49342
183,6.046615,209.85.202.95,192.168.178.54,TLSv1.2,93,Application Data,443,49342
184,6.046843,192.168.178.54,192.168.178.1,TCP,56,"49760  >  53 [PSH, ACK] Seq=1 Ack=1 Win=131328 Len=2 [TCP segment of a reassembled PDU]",49760,53
185,6.04686,192.168.178.54,192.168.178.1,TCP,56,"49762  >  53 [PSH, ACK] Seq=1 Ack=1 Win=131328 Len=2 [TCP segment of a reassembled PDU]",49762,53
186,6.046875,192.168.178.54,192.168.178.1,TCP,56,"49761  >  53 [PSH, ACK] Seq=1 Ack=1 Win=131328 Len=2 [TCP segment of a reassembled PDU]",49761,53
187,6.046876,192.168.178.54,192.168.178.1,DNS,91,Standard query 0x5270 A www.ticketmaster.ie,49760,53
188,6.046894,192.168.178.54,192.168.178.1,DNS,86,Standard query 0xddb3 A uk.tmconst.com,49762,53
189,6.046902,192.168.178.54,192.168.178.1,TCP,56,"49763  >  53 [PSH, ACK] Seq=1 Ack=1 Win=131328 Len=2 [TCP segment of a reassembled PDU]",49763,53
190,6.046904,192.168.178.54,192.168.178.1,DNS,91,Standard query 0x7f10 HTTPS www.ticketmaster.ie,49761,53
191,6.046939,192.168.178.54,192.168.178.1,DNS,86,Standard query 0x9c6f HTTPS uk.tmconst.com,49763,53
192,6.047271,192.168.178.54,192.168.178.1,TCP,56,"49764  >  53 [PSH, ACK] Seq=1 Ack=1 Win=131328 Len=2 [TCP segment of a reassembled PDU]",49764,53
193,6.047283,192.168.178.54,192.168.178.1,DNS,89,Standard query 0x314b A cdn.cookielaw.org,49764,53
194,6.047419,192.168.178.54,192.168.178.1,TCP,56,"49765  >  53 [PSH, ACK] Seq=1 Ack=1 Win=131328 Len=2 [TCP segment of a reassembled PDU]",49765,53
195,6.047433,192.168.178.54,192.168.178.1,DNS,89,Standard query 0xe840 HTTPS cdn.cookielaw.org,49765,53
197,6.048832,192.168.178.1,192.168.178.54,TCP,54,53  >  49760 [ACK] Seq=1 Ack=3 Win=29216 Len=0,53,49760
198,6.048832,192.168.178.1,192.168.178.54,TCP,54,53  >  49760 [ACK] Seq=1 Ack=40 Win=29216 Len=0,53,49760
199,6.050062,192.168.178.1,192.168.178.54,TCP,54,53  >  49762 [ACK] Seq=1 Ack=3 Win=29216 Len=0,53,49762
200,6.050062,192.168.178.1,192.168.178.54,TCP,54,53  >  49761 [ACK] Seq=1 Ack=3 Win=29216 Len=0,53,49761
201,6.050062,192.168.178.1,192.168.178.54,TCP,54,53  >  49762 [ACK] Seq=1 Ack=35 Win=29216 Len=0,53,49762
202,6.050062,192.168.178.1,192.168.178.54,TCP,54,53  >  49761 [ACK] Seq=1 Ack=40 Win=29216 Len=0,53,49761
203,6.050062,192.168.178.1,192.168.178.54,TCP,54,53  >  49763 [ACK] Seq=1 Ack=3 Win=29216 Len=0,53,49763
204,6.050062,192.168.178.1,192.168.178.54,TCP,54,53  >  49763 [ACK] Seq=1 Ack=35 Win=29216 Len=0,53,49763
205,6.050062,192.168.178.1,192.168.178.54,TCP,54,53  >  49764 [ACK] Seq=1 Ack=3 Win=29216 Len=0,53,49764
206,6.050062,192.168.178.1,192.168.178.54,TCP,54,53  >  49764 [ACK] Seq=1 Ack=38 Win=29216 Len=0,53,49764
207,6.050062,192.168.178.1,192.168.178.54,TCP,54,53  >  49765 [ACK] Seq=1 Ack=3 Win=29216 Len=0,53,49765
208,6.050062,192.168.178.1,192.168.178.54,TCP,54,53  >  49765 [ACK] Seq=1 Ack=38 Win=29216 Len=0,53,49765
209,6.051196,209.85.202.95,192.168.178.54,TCP,54,443  >  49342 [ACK] Seq=40 Ack=215 Win=303 Len=0,443,49342
212,6.052309,3.162.140.129,192.168.178.54,TCP,54,443  >  49604 [ACK] Seq=26 Ack=2 Win=131 Len=0,443,49604
213,6.052309,192.168.178.1,192.168.178.54,DNS,123,Standard query response 0x314b A cdn.cookielaw.org A 104.18.130.236 A 104.18.131.236,53,49764
214,6.052309,192.168.178.1,192.168.178.54,DNS,161,Standard query response 0xe840 HTTPS cdn.cookielaw.org HTTPS,53,49765
215,6.052309,172.253.116.91,192.168.178.54,TCP,54,443  >  49399 [ACK] Seq=1 Ack=79 Win=289 Len=0,443,49399
216,6.052309,172.253.116.91,192.168.178.54,TCP,54,443  >  49399 [ACK] Seq=1 Ack=118 Win=289 Len=0,443,49399
217,6.052309,172.253.116.91,192.168.178.54,TCP,54,443  >  49399 [ACK] Seq=1 Ack=341 Win=297 Len=0,443,49399
218,6.052309,172.253.116.91,192.168.178.54,TLSv1.2,93,Application Data,443,49399
220,6.05282,192.168.178.54,192.168.178.1,TCP,54,"49764  >  53 [FIN, ACK] Seq=38 Ack=70 Win=131328 Len=0",49764,53
221,6.053046,192.168.178.54,192.168.178.1,TCP,54,"49765  >  53 [FIN, ACK] Seq=38 Ack=108 Win=131072 Len=0",49765,53
222,6.053401,192.168.178.54,104.18.130.236,TCP,66,49768  >  443 [SYN] Seq=0 Win=64240 Len=0 MSS=1460 WS=256 SACK_PERM,49768,443
225,6.053691,192.168.178.54,192.168.178.1,TCP,66,49769  >  53 [SYN] Seq=0 Win=64240 Len=0 MSS=1460 WS=256 SACK_PERM,49769,53
226,6.053815,192.168.178.54,192.168.178.1,TCP,66,49770  >  53 [SYN] Seq=0 Win=64240 Len=0 MSS=1460 WS=256 SACK_PERM,49770,53
230,6.054447,192.168.178.1,192.168.178.54,TCP,54,"53  >  49764 [FIN, ACK] Seq=70 Ack=39 Win=29216 Len=0",53,49764
232,6.055043,192.168.178.54,192.168.178.1,TCP,54,49764  >  53 [ACK] Seq=39 Ack=71 Win=131328 Len=0,49764,53
235,6.055819,192.168.178.1,192.168.178.54,TCP,66,"53  >  49769 [SYN, ACK] Seq=0 Ack=1 Win=29200 Len=0 MSS=1460 SACK_PERM WS=32",53,49769
238,6.055933,192.168.178.54,192.168.178.1,TCP,54,49769  >  53 [ACK] Seq=1 Ack=1 Win=131328 Len=0,49769,53
239,6.056397,192.168.178.54,192.168.178.1,TCP,56,"49769  >  53 [PSH, ACK] Seq=1 Ack=1 Win=131328 Len=2 [TCP segment of a reassembled PDU]",49769,53
240,6.056409,192.168.178.54,192.168.178.1,DNS,92,Standard query 0x1e58 A epsf.ticketmaster.ie,49769,53
241,6.056812,192.168.178.1,192.168.178.54,TCP,54,"53  >  49765 [FIN, ACK] Seq=108 Ack=39 Win=29216 Len=0",53,49765
242,6.056812,192.168.178.1,192.168.178.54,TCP,66,"53  >  49770 [SYN, ACK] Seq=0 Ack=1 Win=29200 Len=0 MSS=1460 SACK_PERM WS=32",53,49770
245,6.056979,192.168.178.54,192.168.178.1,TCP,54,49770  >  53 [ACK] Seq=1 Ack=1 Win=131328 Len=0,49770,53
246,6.057129,192.168.178.54,192.168.178.1,TCP,54,49765  >  53 [ACK] Seq=39 Ack=109 Win=131072 Len=0,49765,53
247,6.057534,192.168.178.54,192.168.178.1,TCP,56,"49770  >  53 [PSH, ACK] Seq=1 Ack=1 Win=131328 Len=2 [TCP segment of a reassembled PDU]",49770,53
248,6.057553,192.168.178.54,192.168.178.1,DNS,92,Standard query 0x0183 HTTPS epsf.ticketmaster.ie,49770,53
249,6.058016,192.168.178.1,192.168.178.54,TCP,54,53  >  49769 [ACK] Seq=1 Ack=3 Win=29216 Len=0,53,49769
250,6.058016,192.168.178.1,192.168.178.54,TCP,54,53  >  49769 [ACK] Seq=1 Ack=41 Win=29216 Len=0,53,49769
251,6.059089,192.168.178.1,192.168.178.54,TCP,54,53  >  49770 [ACK] Seq=1 Ack=3 Win=29216 Len=0,53,49770
252,6.059089,192.168.178.1,192.168.178.54,TCP,54,53  >  49770 [ACK] Seq=1 Ack=41 Win=29216 Len=0,53,49770
255,6.062365,192.168.178.1,192.168.178.54,DNS,155,Standard query response 0xddb3 A uk.tmconst.com CNAME dualstack.ticketmaster.map.fastly.net A 199.232.26.87,53,49762
256,6.062365,192.168.178.1,192.168.178.54,DNS,197,Standard query response 0x9c6f HTTPS uk.tmconst.com CNAME dualstack.ticketmaster.map.fastly.net SOA ns1.fastly.net,53,49763
257,6.062365,192.168.178.1,192.168.178.54,DNS,155,Standard query response 0x5270 A www.ticketmaster.ie CNAME ticketmaster-intl.map.fastly.net A 199.232.26.87,53,49760
258,6.062654,192.168.178.54,192.168.178.1,TCP,54,"49763  >  53 [FIN, ACK] Seq=35 Ack=144 Win=131072 Len=0",49763,53
259,6.062741,192.168.178.54,192.168.178.1,TCP,54,"49762  >  53 [FIN, ACK] Seq=35 Ack=102 Win=131072 Len=0",49762,53
260,6.062777,192.168.178.54,192.168.178.1,TCP,54,"49760  >  53 [FIN, ACK] Seq=40 Ack=102 Win=131072 Len=0",49760,53
261,6.063079,192.168.178.54,192.168.178.1,TCP,66,49771  >  53 [SYN] Seq=0 Win=64240 Len=0 MSS=1460 WS=256 SACK_PERM,49771,53
262,6.063224,192.168.178.54,192.168.178.1,TCP,66,49772  >  53 [SYN] Seq=0 Win=64240 Len=0 MSS=1460 WS=256 SACK_PERM,49772,53
263,6.064809,192.168.178.1,192.168.178.54,DNS,200,Standard query response 0x7f10 HTTPS www.ticketmaster.ie CNAME ticketmaster-intl.map.fastly.net SOA ns1.fastly.net,53,49761
264,6.064809,104.18.130.236,192.168.178.54,TCP,66,"443  >  49768 [SYN, ACK] Seq=0 Ack=1 Win=64240 Len=0 MSS=1400 SACK_PERM WS=8192",443,49768
266,6.064809,192.168.178.1,192.168.178.54,TCP,66,"53  >  49771 [SYN, ACK] Seq=0 Ack=1 Win=29200 Len=0 MSS=1460 SACK_PERM WS=32",53,49771
267,6.064809,192.168.178.1,192.168.178.54,TCP,66,"53  >  49772 [SYN, ACK] Seq=0 Ack=1 Win=29200 Len=0 MSS=1460 SACK_PERM WS=32",53,49772
268,6.065172,192.168.178.54,104.18.130.236,TCP,54,49768  >  443 [ACK] Seq=1 Ack=1 Win=131584 Len=0,49768,443
269,6.06521,192.168.178.54,192.168.178.1,TCP,54,49771  >  53 [ACK] Seq=1 Ack=1 Win=131328 Len=0,49771,53
270,6.065218,192.168.178.54,192.168.178.1,TCP,54,49772  >  53 [ACK] Seq=1 Ack=1 Win=131328 Len=0,49772,53
271,6.065806,192.168.178.54,199.232.26.87,TCP,66,49773  >  443 [SYN] Seq=0 Win=64240 Len=0 MSS=1460 WS=256 SACK_PERM,49773,443
272,6.065942,192.168.178.1,192.168.178.54,TCP,54,"53  >  49763 [FIN, ACK] Seq=144 Ack=36 Win=29216 Len=0",53,49763
274,6.065942,192.168.178.1,192.168.178.54,TCP,54,"53  >  49760 [FIN, ACK] Seq=102 Ack=41 Win=29216 Len=0",53,49760
275,6.065942,192.168.178.1,192.168.178.54,TCP,54,"53  >  49762 [FIN, ACK] Seq=102 Ack=36 Win=29216 Len=0",53,49762
276,6.066184,192.168.178.54,192.168.178.1,TCP,56,"49771  >  53 [PSH, ACK] Seq=1 Ack=1 Win=131328 Len=2 [TCP segment of a reassembled PDU]",49771,53
277,6.066202,192.168.178.54,192.168.178.1,TCP,54,49763  >  53 [ACK] Seq=36 Ack=145 Win=131072 Len=0,49763,53
278,6.066202,192.168.178.54,192.168.178.1,TCP,66,49774  >  80 [SYN] Seq=0 Win=64240 Len=0 MSS=1460 WS=256 SACK_PERM,49774,80
279,6.066227,192.168.178.54,192.168.178.1,DNS,102,Standard query 0x9aa0 A 1362441.collect.igodigital.com,49771,53
280,6.066261,192.168.178.54,192.168.178.1,TCP,54,49762  >  53 [ACK] Seq=36 Ack=103 Win=131072 Len=0,49762,53
282,6.066345,192.168.178.54,192.168.178.1,TCP,54,49760  >  53 [ACK] Seq=41 Ack=103 Win=131072 Len=0,49760,53
284,6.066549,192.168.178.54,192.168.178.1,TCP,66,49775  >  53 [SYN] Seq=0 Win=64240 Len=0 MSS=1460 WS=256 SACK_PERM,49775,53
285,6.066647,192.168.178.54,104.18.130.236,TLSv1.3,591,Client Hello,49768,443
286,6.066657,192.168.178.54,192.168.178.1,TCP,66,49776  >  53 [SYN] Seq=0 Win=64240 Len=0 MSS=1460 WS=256 SACK_PERM,49776,53
287,6.066683,192.168.178.54,192.168.178.1,TCP,54,"49761  >  53 [FIN, ACK] Seq=40 Ack=147 Win=131072 Len=0",49761,53
288,6.066815,192.168.178.54,192.168.178.1,TCP,56,"49772  >  53 [PSH, ACK] Seq=1 Ack=1 Win=131328 Len=2 [TCP segment of a reassembled PDU]",49772,53
289,6.066833,192.168.178.54,192.168.178.1,DNS,102,Standard query 0x497d HTTPS 1362441.collect.igodigital.com,49772,53
290,6.067927,192.168.178.1,192.168.178.54,TCP,54,53  >  49771 [ACK] Seq=1 Ack=3 Win=29216 Len=0,53,49771
291,6.067927,192.168.178.1,192.168.178.54,TCP,54,53  >  49771 [ACK] Seq=1 Ack=51 Win=29216 Len=0,53,49771
292,6.067927,192.168.178.1,192.168.178.54,TCP,66,"80  >  49774 [SYN, ACK] Seq=0 Ack=1 Win=29200 Len=0 MSS=1460 SACK_PERM WS=32",80,49774
293,6.068071,192.168.178.54,192.168.178.1,TCP,54,49774  >  80 [ACK] Seq=1 Ack=1 Win=131328 Len=0,49774,80
294,6.068779,192.168.178.54,34.149.211.227,TLSv1.2,454,Application Data,65451,443
295,6.068901,192.168.178.54,192.168.178.1,HTTP,273,GET /wpad.dat HTTP/1.1 ,49774,80
296,6.068913,192.168.178.1,192.168.178.54,TCP,54,53  >  49772 [ACK] Seq=1 Ack=3 Win=29216 Len=0,53,49772
297,6.068913,192.168.178.1,192.168.178.54,TCP,54,53  >  49772 [ACK] Seq=1 Ack=51 Win=29216 Len=0,53,49772
299,6.068913,192.168.178.1,192.168.178.54,TCP,66,"53  >  49775 [SYN, ACK] Seq=0 Ack=1 Win=29200 Len=0 MSS=1460 SACK_PERM WS=32",53,49775
300,6.069038,192.168.178.54,192.168.178.1,TCP,54,49775  >  53 [ACK] Seq=1 Ack=1 Win=131328 Len=0,49775,53
302,6.069593,192.168.178.54,192.168.178.1,TCP,56,"49775  >  53 [PSH, ACK] Seq=1 Ack=1 Win=131328 Len=2 [TCP segment of a reassembled PDU]",49775,53
303,6.069604,192.168.178.54,192.168.178.1,DNS,87,Standard query 0x14f9 A se.monetate.net,49775,53
304,6.070453,192.168.178.1,192.168.178.54,TCP,66,"53  >  49776 [SYN, ACK] Seq=0 Ack=1 Win=29200 Len=0 MSS=1460 SACK_PERM WS=32",53,49776
305,6.070453,192.168.178.1,192.168.178.54,TCP,54,80  >  49774 [ACK] Seq=1 Ack=220 Win=30272 Len=0,80,49774
306,6.07056,192.168.178.54,192.168.178.1,TCP,54,49776  >  53 [ACK] Seq=1 Ack=1 Win=131328 Len=0,49776,53
307,6.071164,192.168.178.54,192.168.178.1,TCP,56,"49776  >  53 [PSH, ACK] Seq=1 Ack=1 Win=131328 Len=2 [TCP segment of a reassembled PDU]",49776,53
308,6.071182,192.168.178.54,192.168.178.1,DNS,87,Standard query 0xcc22 HTTPS se.monetate.net,49776,53
309,6.071444,192.168.178.1,192.168.178.54,TCP,54,53  >  49775 [ACK] Seq=1 Ack=3 Win=29216 Len=0,53,49775
310,6.071444,192.168.178.1,192.168.178.54,TCP,54,53  >  49775 [ACK] Seq=1 Ack=36 Win=29216 Len=0,53,49775
311,6.072738,199.232.26.87,192.168.178.54,TCP,66,"443  >  49773 [SYN, ACK] Seq=0 Ack=1 Win=65535 Len=0 MSS=1452 SACK_PERM WS=512",443,49773
312,6.072738,192.168.178.1,192.168.178.54,TCP,54,53  >  49776 [ACK] Seq=1 Ack=3 Win=29216 Len=0,53,49776
313,6.072738,192.168.178.1,192.168.178.54,TCP,54,53  >  49776 [ACK] Seq=1 Ack=36 Win=29216 Len=0,53,49776
314,6.072738,192.168.178.1,192.168.178.54,TCP,163,"80  >  49774 [PSH, ACK] Seq=1 Ack=220 Win=30272 Len=109 [TCP segment of a reassembled PDU]",80,49774
315,6.072738,192.168.178.1,192.168.178.54,TCP,1514,80  >  49774 [ACK] Seq=110 Ack=220 Win=30272 Len=1460 [TCP segment of a reassembled PDU],80,49774
316,6.072982,192.168.178.54,199.232.26.87,TCP,54,49773  >  443 [ACK] Seq=1 Ack=1 Win=132096 Len=0,49773,443
317,6.073004,192.168.178.54,192.168.178.1,TCP,54,49774  >  80 [ACK] Seq=220 Ack=1570 Win=131328 Len=0,49774,80
318,6.073312,192.168.178.54,192.168.178.1,TCP,54,"49774  >  80 [FIN, ACK] Seq=220 Ack=1570 Win=131328 Len=0",49774,80
319,6.073861,192.168.178.54,199.232.26.87,TLSv1.2,318,Client Hello,49773,443
320,6.074852,192.168.178.1,192.168.178.54,HTTP,440,HTTP/1.1 400 Bad Request  (text/html),80,49774
321,6.07489,192.168.178.54,192.168.178.1,TCP,54,"49774  >  80 [RST, ACK] Seq=221 Ack=1956 Win=0 Len=0",49774,80
322,6.07599,104.18.130.236,192.168.178.54,TCP,54,443  >  49768 [ACK] Seq=1 Ack=538 Win=57344 Len=0,443,49768
323,6.07599,192.168.178.1,192.168.178.54,DNS,152,Standard query response 0x1e58 A epsf.ticketmaster.ie CNAME ticketmaster2.map.fastly.net A 199.232.26.87,53,49769
324,6.07599,192.168.178.1,192.168.178.54,DNS,197,Standard query response 0x0183 HTTPS epsf.ticketmaster.ie CNAME ticketmaster2.map.fastly.net SOA ns1.fastly.net,53,49770
325,6.076355,192.168.178.54,192.168.178.1,TCP,54,"49769  >  53 [FIN, ACK] Seq=41 Ack=99 Win=131072 Len=0",49769,53
326,6.076429,192.168.178.54,192.168.178.1,TCP,54,"49770  >  53 [FIN, ACK] Seq=41 Ack=144 Win=131072 Len=0",49770,53
327,6.076781,192.168.178.54,192.168.178.1,TCP,66,49777  >  53 [SYN] Seq=0 Win=64240 Len=0 MSS=1460 WS=256 SACK_PERM,49777,53
328,6.076902,192.168.178.54,192.168.178.1,TCP,66,49778  >  53 [SYN] Seq=0 Win=64240 Len=0 MSS=1460 WS=256 SACK_PERM,49778,53
329,6.076944,192.168.178.1,192.168.178.54,TCP,54,"53  >  49761 [FIN, ACK] Seq=147 Ack=41 Win=29216 Len=0",53,49761
330,6.077115,192.168.178.54,192.168.178.1,TCP,54,49761  >  53 [ACK] Seq=41 Ack=148 Win=131072 Len=0,49761,53
331,6.078266,192.168.178.1,192.168.178.54,DNS,283,Standard query response 0x9aa0 A 1362441.collect.igodigital.com CNAME nova.collect.igodigital.com CNAME nova-collector-1192479543.us-east-1.elb.amazonaws.com A 52.202.55.90 A 54.145.98.26 A 52.207.156.186 A 34.232.254.207 A 34.230.234.159 A 54.92.198.22,53,49771
332,6.078266,199.232.26.87,192.168.178.54,TCP,54,443  >  49773 [ACK] Seq=1 Ack=265 Win=147456 Len=0,443,49773
333,6.078266,192.168.178.1,192.168.178.54,TCP,66,"53  >  49777 [SYN, ACK] Seq=0 Ack=1 Win=29200 Len=0 MSS=1460 SACK_PERM WS=32",53,49777
334,6.078266,172.253.116.91,192.168.178.54,TLSv1.2,124,Application Data,443,49399
335,6.078266,192.168.178.1,192.168.178.54,TCP,66,"53  >  49778 [SYN, ACK] Seq=0 Ack=1 Win=29200 Len=0 MSS=1460 SACK_PERM WS=32",53,49778
336,6.078266,172.253.116.91,192.168.178.54,TLSv1.2,116,Application Data,443,49399
337,6.078266,172.253.116.91,192.168.178.54,TLSv1.2,85,Application Data,443,49399
338,6.078516,192.168.178.54,192.168.178.1,TCP,54,49777  >  53 [ACK] Seq=1 Ack=1 Win=131328 Len=0,49777,53
339,6.078533,192.168.178.54,172.253.116.91,TCP,54,49399  >  443 [ACK] Seq=341 Ack=203 Win=511 Len=0,49399,443
340,6.07854,192.168.178.54,192.168.178.1,TCP,54,49778  >  53 [ACK] Seq=1 Ack=1 Win=131328 Len=0,49778,53
341,6.079105,192.168.178.54,172.253.116.91,TLSv1.2,89,Application Data,49399,443
342,6.079111,192.168.178.54,192.168.178.1,TCP,54,"49771  >  53 [FIN, ACK] Seq=51 Ack=230 Win=131072 Len=0",49771,53
343,6.079115,192.168.178.54,192.168.178.1,TCP,56,"49777  >  53 [PSH, ACK] Seq=1 Ack=1 Win=131328 Len=2 [TCP segment of a reassembled PDU]",49777,53
344,6.079127,192.168.178.54,192.168.178.1,DNS,97,Standard query 0x25d2 A www.googletagservices.com,49777,53
345,6.079268,192.168.178.54,192.168.178.1,TCP,56,"49778  >  53 [PSH, ACK] Seq=1 Ack=1 Win=131328 Len=2 [TCP segment of a reassembled PDU]",49778,53
346,6.079285,192.168.178.54,192.168.178.1,DNS,97,Standard query 0xc175 HTTPS www.googletagservices.com,49778,53
347,6.080555,104.18.130.236,192.168.178.54,TLSv1.3,1506,"Server Hello, Change Cipher Spec",443,49768
348,6.080555,104.18.130.236,192.168.178.54,TLSv1.3,787,Application Data,443,49768
349,6.080555,172.253.116.91,192.168.178.54,TLSv1.2,93,Application Data,443,49399
350,6.080555,192.168.178.1,192.168.178.54,TCP,54,"53  >  49769 [FIN, ACK] Seq=99 Ack=42 Win=29216 Len=0",53,49769
351,6.080555,192.168.178.1,192.168.178.54,TCP,54,"53  >  49770 [FIN, ACK] Seq=144 Ack=42 Win=29216 Len=0",53,49770
352,6.080555,34.149.211.227,192.168.178.54,TCP,54,443  >  65451 [ACK] Seq=1 Ack=401 Win=430 Len=0,443,65451
353,6.080555,199.232.26.87,192.168.178.54,TLSv1.2,1506,Server Hello,443,49773
354,6.080555,199.232.26.87,192.168.178.54,TCP,1506,443  >  49773 [ACK] Seq=1453 Ack=265 Win=147456 Len=1452 [TCP segment of a reassembled PDU],443,49773
355,6.080555,199.232.26.87,192.168.178.54,TCP,1506,443  >  49773 [ACK] Seq=2905 Ack=265 Win=147456 Len=1452 [TCP segment of a reassembled PDU],443,49773
356,6.080555,199.232.26.87,192.168.178.54,TLSv1.2,1048,"Certificate, Server Key Exchange, Server Hello Done",443,49773
357,6.080555,192.168.178.1,192.168.178.54,TCP,54,53  >  49777 [ACK] Seq=1 Ack=3 Win=29216 Len=0,53,49777
358,6.080555,192.168.178.1,192.168.178.54,TCP,54,53  >  49777 [ACK] Seq=1 Ack=46 Win=29216 Len=0,53,49777
359,6.080555,192.168.178.1,192.168.178.54,TCP,54,53  >  49778 [ACK] Seq=1 Ack=3 Win=29216 Len=0,53,49778
360,6.080555,192.168.178.1,192.168.178.54,TCP,54,53  >  49778 [ACK] Seq=1 Ack=46 Win=29216 Len=0,53,49778
361,6.080755,192.168.178.54,104.18.130.236,TCP,54,49768  >  443 [ACK] Seq=538 Ack=2186 Win=131584 Len=0,49768,443
362,6.080764,192.168.178.54,172.253.116.91,TLSv1.2,93,Application Data,49399,443
363,6.080784,192.168.178.54,34.149.211.227,TLSv1.2,216,Application Data,65451,443
364,6.080794,192.168.178.54,199.232.26.87,TCP,54,49773  >  443 [ACK] Seq=265 Ack=5351 Win=132096 Len=0,49773,443
365,6.080959,192.168.178.54,192.168.178.1,TCP,54,49769  >  53 [ACK] Seq=42 Ack=100 Win=131072 Len=0,49769,53
366,6.081013,192.168.178.54,192.168.178.1,TCP,54,49770  >  53 [ACK] Seq=42 Ack=145 Win=131072 Len=0,49770,53
367,6.081341,192.168.178.54,104.18.130.236,TLSv1.3,118,"Change Cipher Spec, Application Data",49768,443
368,6.081813,192.168.178.1,192.168.178.54,DNS,163,Standard query response 0x25d2 A www.googletagservices.com A 209.85.202.155 A 209.85.202.157 A 209.85.202.156 A 209.85.202.154,53,49777
369,6.081813,192.168.178.1,192.168.178.54,DNS,156,Standard query response 0xc175 HTTPS www.googletagservices.com SOA ns1.google.com,53,49778
370,6.081813,192.168.178.1,192.168.178.54,DNS,269,Standard query response 0x497d HTTPS 1362441.collect.igodigital.com CNAME nova.collect.igodigital.com CNAME nova-collector-1192479543.us-east-1.elb.amazonaws.com SOA ns-1119.awsdns-11.org,53,49772
371,6.081865,192.168.178.54,34.149.211.227,TLSv1.2,457,Application Data,65446,443
372,6.081957,192.168.178.54,34.149.211.227,TCP,1466,65446  >  443 [ACK] Seq=404 Ack=1 Win=512 Len=1412 [TCP segment of a reassembled PDU],65446,443
373,6.081957,192.168.178.54,34.149.211.227,TCP,1466,65446  >  443 [ACK] Seq=1816 Ack=1 Win=512 Len=1412 [TCP segment of a reassembled PDU],65446,443
374,6.081957,192.168.178.54,34.149.211.227,TCP,1466,65446  >  443 [ACK] Seq=3228 Ack=1 Win=512 Len=1412 [TCP segment of a reassembled PDU],65446,443
375,6.081957,192.168.178.54,34.149.211.227,TCP,1466,65446  >  443 [ACK] Seq=4640 Ack=1 Win=512 Len=1412 [TCP segment of a reassembled PDU],65446,443
376,6.081957,192.168.178.54,34.149.211.227,TCP,1466,65446  >  443 [ACK] Seq=6052 Ack=1 Win=512 Len=1412 [TCP segment of a reassembled PDU],65446,443
377,6.081957,192.168.178.54,34.149.211.227,TLSv1.2,1227,Application Data,65446,443
378,6.082125,192.168.178.54,192.168.178.1,TCP,54,"49778  >  53 [FIN, ACK] Seq=46 Ack=103 Win=131072 Len=0",49778,53
379,6.0822,192.168.178.54,192.168.178.1,TCP,54,"49772  >  53 [FIN, ACK] Seq=51 Ack=216 Win=131072 Len=0",49772,53
380,6.082484,192.168.178.54,192.168.178.1,TCP,66,49779  >  53 [SYN] Seq=0 Win=64240 Len=0 MSS=1460 WS=256 SACK_PERM,49779,53
381,6.082607,192.168.178.54,192.168.178.1,TCP,66,49780  >  53 [SYN] Seq=0 Win=64240 Len=0 MSS=1460 WS=256 SACK_PERM,49780,53
382,6.082947,192.168.178.1,192.168.178.54,TCP,54,"53  >  49771 [FIN, ACK] Seq=230 Ack=52 Win=29216 Len=0",53,49771
383,6.0832,192.168.178.54,192.168.178.1,TCP,54,49771  >  53 [ACK] Seq=52 Ack=231 Win=131072 Len=0,49771,53
384,6.084875,192.168.178.1,192.168.178.54,TCP,66,"53  >  49779 [SYN, ACK] Seq=0 Ack=1 Win=29200 Len=0 MSS=1460 SACK_PERM WS=32",53,49779
385,6.084875,192.168.178.1,192.168.178.54,TCP,66,"53  >  49780 [SYN, ACK] Seq=0 Ack=1 Win=29200 Len=0 MSS=1460 SACK_PERM WS=32",53,49780
386,6.084875,192.168.178.1,192.168.178.54,TCP,54,"53  >  49778 [FIN, ACK] Seq=103 Ack=47 Win=29216 Len=0",53,49778
387,6.085091,192.168.178.54,192.168.178.1,TCP,54,49779  >  53 [ACK] Seq=1 Ack=1 Win=131328 Len=0,49779,53
388,6.085114,192.168.178.54,192.168.178.1,TCP,54,49780  >  53 [ACK] Seq=1 Ack=1 Win=131328 Len=0,49780,53
389,6.085255,192.168.178.54,192.168.178.1,TCP,54,49778  >  53 [ACK] Seq=47 Ack=104 Win=131072 Len=0,49778,53
390,6.085773,192.168.178.54,192.168.178.1,TCP,56,"49779  >  53 [PSH, ACK] Seq=1 Ack=1 Win=131328 Len=2 [TCP segment of a reassembled PDU]",49779,53
391,6.085789,192.168.178.54,192.168.178.1,TCP,56,"49780  >  53 [PSH, ACK] Seq=1 Ack=1 Win=131328 Len=2 [TCP segment of a reassembled PDU]",49780,53
392,6.085795,192.168.178.54,192.168.178.1,DNS,89,Standard query 0x5362 A cdn.permutive.com,49779,53
393,6.085811,192.168.178.54,192.168.178.1,DNS,89,Standard query 0xfd8c HTTPS cdn.permutive.com,49780,53
394,6.085871,192.168.178.1,192.168.178.54,TCP,54,"53  >  49772 [FIN, ACK] Seq=216 Ack=52 Win=29216 Len=0",53,49772
395,6.085871,167.235.124.60,192.168.178.54,TCP,54,443  >  49649 [ACK] Seq=26 Ack=2 Win=165 Len=0,443,49649
396,6.085871,167.235.124.60,192.168.178.54,TCP,54,443  >  49650 [ACK] Seq=26 Ack=2 Win=165 Len=0,443,49650
397,6.085871,167.235.124.60,192.168.178.54,TCP,54,443  >  49644 [ACK] Seq=26 Ack=2 Win=165 Len=0,443,49644
398,6.085871,34.149.211.227,192.168.178.54,TCP,54,443  >  65451 [ACK] Seq=1 Ack=563 Win=441 Len=0,443,65451
399,6.085931,192.168.178.54,167.235.124.60,TCP,54,49649  >  443 [RST] Seq=2 Win=0 Len=0,49649,443
400,6.085947,192.168.178.54,167.235.124.60,TCP,54,49650  >  443 [RST] Seq=2 Win=0 Len=0,49650,443
401,6.085955,192.168.178.54,167.235.124.60,TCP,54,49644  >  443 [RST] Seq=2 Win=0 Len=0,49644,443
402,6.086101,192.168.178.54,192.168.178.1,TCP,54,49772  >  53 [ACK] Seq=52 Ack=217 Win=131072 Len=0,49772,53
403,6.087178,172.253.116.91,192.168.178.54,TCP,54,443  >  49399 [ACK] Seq=242 Ack=415 Win=297 Len=0,443,49399
404,6.087178,192.168.178.1,192.168.178.54,TCP,54,53  >  49779 [ACK] Seq=1 Ack=3 Win=29216 Len=0,53,49779
405,6.087178,192.168.178.1,192.168.178.54,TCP,54,53  >  49780 [ACK] Seq=1 Ack=3 Win=29216 Len=0,53,49780
406,6.087178,192.168.178.1,192.168.178.54,TCP,54,53  >  49780 [ACK] Seq=1 Ack=38 Win=29216 Len=0,53,49780
407,6.087178,192.168.178.1,192.168.178.54,TCP,54,53  >  49779 [ACK] Seq=1 Ack=38 Win=29216 Len=0,53,49779
408,6.088303,192.168.178.1,192.168.178.54,DNS,123,Standard query response 0x5362 A cdn.permutive.com A 104.17.118.17 A 104.17.119.17,53,49779
409,6.088303,192.168.178.1,192.168.178.54,DNS,161,Standard query response 0xfd8c HTTPS cdn.permutive.com HTTPS,53,49780
410,6.088303,34.149.211.227,192.168.178.54,TCP,54,443  >  65446 [ACK] Seq=1 Ack=1816 Win=405 Len=0,443,65446
411,6.088303,34.149.211.227,192.168.178.54,TCP,54,443  >  65446 [ACK] Seq=1 Ack=4640 Win=427 Len=0,443,65446
