No.,Time,Source,Destination,Protocol,Length,Info,Source Port,Destination Port,Human
1,0,3232281170,3758096635,MDNS,152,"Standard query 0x00a4 PTR _%9E5E7C8F47989526C9BCD95D24084F6F0B27C5ED._sub._googlecast._tcp.local, ""QM"" question PTR _CFE7FEDA._sub._googlecast._tcp.local, ""QM"" question PTR _googlecast._tcp.local, ""QM"" question",5353,5353,
4,0.061984,3232281142,1249755493,TCP,1466,51282  >  443 [ACK] Seq=1 Ack=1 Win=509 Len=1412 [TCP segment of a reassembled PDU],51282,443,
5,0.061984,3232281142,1249755493,TLSv1.2,1464,Application Data,51282,443,
6,0.062056,3232281142,1249755493,TLSv1.2,896,Application Data,51282,443,
7,0.068275,1249755493,3232281142,TCP,54,443  >  51282 [ACK] Seq=1 Ack=2823 Win=11408 Len=0,443,51282,
8,0.073705,1249755493,3232281142,TCP,54,443  >  51282 [ACK] Seq=1 Ack=3665 Win=11418 Len=0,443,51282,
9,0.115945,1249755493,3232281142,TLSv1.2,612,Application Data,443,51282,
10,0.115945,1249755493,3232281142,TLSv1.2,255,Application Data,443,51282,
11,0.115945,1249755493,3232281142,TLSv1.2,132,Application Data,443,51282,
12,0.115945,1249755493,3232281142,TLSv1.2,93,Application Data,443,51282,
13,0.116156,3232281142,1249755493,TCP,54,51282  >  443 [ACK] Seq=3665 Ack=877 Win=512 Len=0,51282,443,
14,0.118444,3232281142,1249755493,TLSv1.2,93,Application Data,51282,443,
15,0.124635,1249755493,3232281142,TCP,54,443  >  51282 [ACK] Seq=877 Ack=3704 Win=11418 Len=0,443,51282,
17,1.285216,3232281142,339092809,TCP,55,49496  >  443 [ACK] Seq=1 Ack=1 Win=516 Len=1 [TCP segment of a reassembled PDU],49496,443,
18,1.291963,339092809,3232281142,TCP,66,443  >  49496 [ACK] Seq=1 Ack=2 Win=7161 Len=0 SLE=1 SRE=2,443,49496,
20,1.725193,3232281112,4026531834,UDP,77,43096  >  15600 Len=35,43096,15600,
23,2.069805,3232281142,1249755493,TCP,1466,51282  >  443 [ACK] Seq=3704 Ack=877 Win=512 Len=1412 [TCP segment of a reassembled PDU],51282,443,
24,2.069805,3232281142,1249755493,TCP,1466,51282  >  443 [ACK] Seq=5116 Ack=877 Win=512 Len=1412 [TCP segment of a reassembled PDU],51282,443,
25,2.069805,3232281142,1249755493,TLSv1.2,56,Application Data,51282,443,
26,2.069875,3232281142,1249755493,TLSv1.2,838,Application Data,51282,443,
27,2.070278,3232281142,3512060766,TLSv1.2,150,Application Data,51326,443,
28,2.070311,3232281142,3512060766,TLSv1.2,93,Application Data,51326,443,
29,2.075739,3512060766,3232281142,TCP,54,443  >  51326 [ACK] Seq=1 Ack=97 Win=272 Len=0,443,51326,
30,2.075739,3512060766,3232281142,TCP,54,443  >  51326 [ACK] Seq=1 Ack=136 Win=272 Len=0,443,51326,
31,2.075739,3512060766,3232281142,TLSv1.2,93,Application Data,443,51326,
32,2.075739,1249755493,3232281142,TCP,54,443  >  51282 [ACK] Seq=877 Ack=5116 Win=11413 Len=0,443,51282,
33,2.075739,1249755493,3232281142,TCP,54,443  >  51282 [ACK] Seq=877 Ack=6528 Win=11408 Len=0,443,51282,
34,2.075739,1249755493,3232281142,TCP,54,443  >  51282 [ACK] Seq=877 Ack=6530 Win=11408 Len=0,443,51282,
35,2.075739,1249755493,3232281142,TCP,54,443  >  51282 [ACK] Seq=877 Ack=7314 Win=11405 Len=0,443,51282,
36,2.077938,3512060766,3232281142,TLSv1.2,150,Application Data,443,51326,
37,2.077938,3512060766,3232281142,TLSv1.2,128,Application Data,443,51326,
38,2.077938,3512060766,3232281142,TLSv1.2,85,Application Data,443,51326,
39,2.077938,3512060766,3232281142,TLSv1.2,93,Application Data,443,51326,
40,2.077994,3232281142,3512060766,TCP,54,51326  >  443 [ACK] Seq=136 Ack=280 Win=508 Len=0,51326,443,
41,2.078312,3232281142,3512060766,TLSv1.2,93,Application Data,51326,443,
42,2.078563,3232281142,3512060766,TLSv1.2,89,Application Data,51326,443,
43,2.084451,3512060766,3232281142,TCP,54,443  >  51326 [ACK] Seq=280 Ack=210 Win=272 Len=0,443,51326,
44,2.098578,1249755493,3232281142,TLSv1.2,592,Application Data,443,51282,
45,2.098578,1249755493,3232281142,TLSv1.2,421,Application Data,443,51282,
46,2.098578,1249755493,3232281142,TLSv1.2,298,Application Data,443,51282,
47,2.098578,1249755493,3232281142,TLSv1.2,93,Application Data,443,51282,
48,2.098631,3232281142,1249755493,TCP,54,51282  >  443 [ACK] Seq=7314 Ack=2065 Win=508 Len=0,51282,443,
49,2.100128,3232281142,1249755493,TLSv1.2,93,Application Data,51282,443,
50,2.110372,1249755493,3232281142,TCP,54,443  >  51282 [ACK] Seq=2065 Ack=7353 Win=11418 Len=0,443,51282,
54,3.0577,3232281142,3512060766,TLSv1.2,154,Application Data,51126,443,
55,3.057772,3232281142,3512060766,TLSv1.2,93,Application Data,51126,443,
56,3.064592,3512060766,3232281142,TCP,54,443  >  51126 [ACK] Seq=1 Ack=101 Win=297 Len=0,443,51126,
57,3.064592,3512060766,3232281142,TCP,54,443  >  51126 [ACK] Seq=1 Ack=140 Win=297 Len=0,443,51126,
58,3.064592,3512060766,3232281142,TLSv1.2,93,Application Data,443,51126,
59,3.067119,3512060766,3232281142,TLSv1.2,126,Application Data,443,51126,
60,3.067119,3512060766,3232281142,TLSv1.2,128,Application Data,443,51126,
61,3.067119,3512060766,3232281142,TLSv1.2,85,Application Data,443,51126,
62,3.067119,3512060766,3232281142,TLSv1.2,93,Application Data,443,51126,
63,3.067191,3232281142,3512060766,TCP,54,51126  >  443 [ACK] Seq=140 Ack=256 Win=508 Len=0,51126,443,
64,3.067848,3232281142,3512060766,TLSv1.2,89,Application Data,51126,443,
65,3.067904,3232281142,3512060766,TLSv1.2,93,Application Data,51126,443,
66,3.073957,3512060766,3232281142,TCP,54,443  >  51126 [ACK] Seq=256 Ack=214 Win=297 Len=0,443,51126,
67,3.273347,3232281142,3512060521,TLSv1.2,1403,"Application Data, Application Data",51503,443,
68,3.273414,3232281142,3512060521,TLSv1.2,93,Application Data,51503,443,
69,3.289992,3512060521,3232281142,TCP,54,443  >  51503 [ACK] Seq=1 Ack=1350 Win=1378 Len=0,443,51503,
70,3.289992,3512060521,3232281142,TCP,54,443  >  51503 [ACK] Seq=1 Ack=1389 Win=1378 Len=0,443,51503,
71,3.289992,3512060521,3232281142,TLSv1.2,93,Application Data,443,51503,
72,3.300128,3232281142,3512060521,TLSv1.2,1466,Application Data,51503,443,
73,3.300128,3232281142,3512060521,TLSv1.2,147,Application Data,51503,443,
74,3.306091,3512060521,3232281142,TCP,54,443  >  51503 [ACK] Seq=40 Ack=2894 Win=1389 Len=0,443,51503,
75,3.31188,3512060521,3232281142,TLSv1.2,345,Application Data,443,51503,
76,3.31188,3512060521,3232281142,TLSv1.2,108,Application Data,443,51503,
77,3.31188,3512060521,3232281142,TLSv1.2,85,Application Data,443,51503,
78,3.31188,3512060521,3232281142,TLSv1.2,93,Application Data,443,51503,
79,3.312005,3232281142,3512060521,TCP,54,51503  >  443 [ACK] Seq=2894 Ack=455 Win=2331 Len=0,51503,443,
80,3.313562,3232281142,3512060521,TLSv1.2,93,Application Data,51503,443,
81,3.314508,3232281142,3512060521,TLSv1.2,89,Application Data,51503,443,
82,3.319039,3232281142,3512060521,TLSv1.2,1435,"Application Data, Application Data",51503,443,
83,3.319985,3512060521,3232281142,TCP,54,443  >  51503 [ACK] Seq=455 Ack=2968 Win=1389 Len=0,443,51503,
84,3.330733,3512060521,3232281142,TCP,54,443  >  51503 [ACK] Seq=455 Ack=4349 Win=1400 Len=0,443,51503,
85,3.356625,3512060521,3232281142,TLSv1.2,319,Application Data,443,51503,
86,3.356625,3512060521,3232281142,TLSv1.2,118,Application Data,443,51503,
87,3.356625,3512060521,3232281142,TLSv1.2,85,Application Data,443,51503,
88,3.356751,3232281142,3512060521,TCP,54,51503  >  443 [ACK] Seq=4349 Ack=815 Win=2329 Len=0,51503,443,
89,3.35788,3512060521,3232281142,TLSv1.2,93,Application Data,443,51503,
90,3.357933,3232281142,3512060521,TCP,54,51503  >  443 [ACK] Seq=4349 Ack=854 Win=2329 Len=0,51503,443,
91,3.358364,3232281142,3512060521,TLSv1.2,93,Application Data,51503,443,
92,3.371086,3512060521,3232281142,TLSv1.2,327,Application Data,443,51503,
93,3.371086,3512060521,3232281142,TLSv1.2,1466,Application Data,443,51503,
94,3.371086,3512060521,3232281142,TLSv1.2,1466,Application Data,443,51503,
95,3.371086,3512060521,3232281142,TLSv1.2,110,Application Data,443,51503,
96,3.371086,3512060521,3232281142,TLSv1.2,1466,Application Data,443,51503,
97,3.371086,3512060521,3232281142,TLSv1.2,1466,Application Data,443,51503,
98,3.371086,3512060521,3232281142,TLSv1.2,1466,Application Data,443,51503,
99,3.371086,3512060521,3232281142,TLSv1.2,1466,Application Data,443,51503,
100,3.371086,3512060521,3232281142,TLSv1.2,1466,Application Data,443,51503,
101,3.371086,3512060521,3232281142,TLSv1.2,1466,Application Data,443,51503,
102,3.371086,3512060521,3232281142,TLSv1.2,1466,Application Data,443,51503,
103,3.371086,3512060521,3232281142,TLSv1.2,1466,Application Data,443,51503,
104,3.371086,3512060521,3232281142,TLSv1.2,1466,Application Data,443,51503,
105,3.371086,3512060521,3232281142,TLSv1.2,1466,Application Data,443,51503,
106,3.371086,3512060521,3232281142,TLSv1.2,1466,Application Data,443,51503,
107,3.371086,3512060521,3232281142,TLSv1.2,1320,Application Data,443,51503,
108,3.371086,3512060521,3232281142,TLSv1.2,1466,Application Data,443,51503,
109,3.371086,3512060521,3232281142,TLSv1.2,1466,Application Data,443,51503,
110,3.371086,3512060521,3232281142,TLSv1.2,1466,Application Data,443,51503,
111,3.371086,3512060521,3232281142,TLSv1.2,1466,Application Data,443,51503,
112,3.371086,3512060521,3232281142,TLSv1.2,1466,Application Data,443,51503,
113,3.371086,3512060521,3232281142,TLSv1.2,1466,Application Data,443,51503,
114,3.371086,3512060521,3232281142,TLSv1.2,1466,Application Data,443,51503,
115,3.371086,3512060521,3232281142,TLSv1.2,1466,Application Data,443,51503,
116,3.371086,3512060521,3232281142,TLSv1.2,1466,Application Data,443,51503,
117,3.371086,3512060521,3232281142,TLSv1.2,1466,Application Data,443,51503,
118,3.371086,3512060521,3232281142,TLSv1.2,1466,Application Data,443,51503,
119,3.371086,3512060521,3232281142,TLSv1.2,1466,Application Data,443,51503,
120,3.371086,3512060521,3232281142,TLSv1.2,1466,Application Data,443,51503,
121,3.371086,3512060521,3232281142,TLSv1.2,1466,Application Data,443,51503,
122,3.371086,3512060521,3232281142,TLSv1.2,354,"Application Data, Application Data",443,51503,
123,3.371086,3512060521,3232281142,TCP,54,443  >  51503 [ACK] Seq=40873 Ack=4388 Win=1400 Len=0,443,51503,
124,3.371653,3232281142,3512060521,TCP,54,51503  >  443 [ACK] Seq=4388 Ack=40873 Win=2333 Len=0,51503,443,
125,3.890809,3232281136,4294967295,UDP,56,62547  >  3289 Len=14,62547,3289,
128,4.021935,3512060511,3232281142,TLSv1.2,217,Application Data,443,51097,
129,4.025207,3232281142,3512060511,TLSv1.2,89,Application Data,51097,443,
130,4.025353,3232281142,3512060511,TLSv1.2,89,Application Data,51097,443,
131,4.030784,3512060511,3232281142,TCP,54,443  >  51097 [ACK] Seq=164 Ack=36 Win=1754 Len=0,443,51097,
132,4.030784,3512060511,3232281142,TCP,54,443  >  51097 [ACK] Seq=164 Ack=71 Win=1754 Len=0,443,51097,
133,4.284307,3232281142,2354213401,TCP,55,51250  >  443 [ACK] Seq=1 Ack=1 Win=511 Len=1 [TCP segment of a reassembled PDU],51250,443,
134,4.374639,2354213401,3232281142,TCP,66,443  >  51250 [ACK] Seq=1 Ack=2 Win=70 Len=0 SLE=1 SRE=2,443,51250,
136,4.582177,3512060511,3232281142,TLSv1.2,217,Application Data,443,51097,
137,4.627774,3232281142,3512060511,TCP,54,51097  >  443 [ACK] Seq=71 Ack=327 Win=511 Len=0,51097,443,
138,4.70169,3232281142,2902291551,TLSv1.2,119,Application Data,51513,443,
139,4.701767,3232281142,2902291551,TLSv1.2,93,Application Data,51513,443,
140,4.701789,3232281142,2902291551,TLSv1.2,341,Application Data,51513,443,
141,4.708062,3232281142,3512060521,TLSv1.2,1466,Application Data,51503,443,
142,4.708062,3232281142,3512060521,TCP,1466,51503  >  443 [ACK] Seq=5800 Ack=40873 Win=2333 Len=1412 [TCP segment of a reassembled PDU],51503,443,
143,4.708062,3232281142,3512060521,TLSv1.2,431,Application Data,51503,443,
144,4.712552,2902291551,3232281142,TCP,54,443  >  51513 [ACK] Seq=1 Ack=66 Win=289 Len=0,443,51513,
145,4.712552,2902291551,3232281142,TCP,54,443  >  51513 [ACK] Seq=1 Ack=105 Win=289 Len=0,443,51513,
146,4.712552,2902291551,3232281142,TCP,54,443  >  51513 [ACK] Seq=1 Ack=392 Win=297 Len=0,443,51513,
147,4.712552,2902291551,3232281142,TLSv1.2,93,Application Data,443,51513,
148,4.713917,3512060521,3232281142,TCP,54,443  >  51503 [ACK] Seq=40873 Ack=5800 Win=1411 Len=0,443,51503,
149,4.713917,3512060521,3232281142,TCP,54,443  >  51503 [ACK] Seq=40873 Ack=7212 Win=1422 Len=0,443,51503,
150,4.713917,3512060521,3232281142,TCP,54,443  >  51503 [ACK] Seq=40873 Ack=7589 Win=1433 Len=0,443,51503,
151,4.764529,2902291551,3232281142,TLSv1.2,128,Application Data,443,51513,
152,4.764529,2902291551,3232281142,TLSv1.2,1466,Application Data,443,51513,
153,4.764529,2902291551,3232281142,TLSv1.2,1466,Application Data,443,51513,
154,4.764529,2902291551,3232281142,TLSv1.2,1466,Application Data,443,51513,
155,4.764644,3232281142,2902291551,TCP,54,51513  >  443 [ACK] Seq=392 Ack=4350 Win=512 Len=0,51513,443,
156,4.764713,2902291551,3232281142,TLSv1.2,994,Application Data,443,51513,
157,4.764759,3232281142,2902291551,TCP,54,51513  >  443 [ACK] Seq=392 Ack=5290 Win=509 Len=0,51513,443,
158,4.764986,3232281142,2902291551,TLSv1.2,89,Application Data,51513,443,
159,4.765557,2902291551,3232281142,TLSv1.2,169,Application Data,443,51513,
160,4.765557,2902291551,3232281142,TLSv1.2,93,Application Data,443,51513,
161,4.765608,3232281142,2902291551,TCP,54,51513  >  443 [ACK] Seq=427 Ack=5444 Win=508 Len=0,51513,443,
162,4.765897,3232281142,2902291551,TLSv1.2,93,Application Data,51513,443,
163,4.771108,2902291551,3232281142,TCP,54,443  >  51513 [ACK] Seq=5444 Ack=466 Win=297 Len=0,443,51513,
164,4.80649,3512060521,3232281142,TLSv1.2,752,Application Data,443,51503,
165,4.808143,3512060521,3232281142,TLSv1.2,1466,Application Data,443,51503,
166,4.808143,3512060521,3232281142,TLSv1.2,1327,Application Data,443,51503,
167,4.808143,3512060521,3232281142,TLSv1.2,147,Application Data,443,51503,
168,4.808143,3512060521,3232281142,TLSv1.2,1466,Application Data,443,51503,
169,4.808143,3512060521,3232281142,TLSv1.2,1466,Application Data,443,51503,
170,4.808143,3512060521,3232281142,TLSv1.2,1466,Application Data,443,51503,
171,4.808143,3512060521,3232281142,TLSv1.2,1466,Application Data,443,51503,
172,4.808143,3512060521,3232281142,TLSv1.2,1466,Application Data,443,51503,
173,4.808143,3512060521,3232281142,TLSv1.2,1466,Application Data,443,51503,
174,4.808143,3512060521,3232281142,TLSv1.2,1466,Application Data,443,51503,
175,4.808143,3512060521,3232281142,TLSv1.2,1466,Application Data,443,51503,
176,4.808143,3512060521,3232281142,TLSv1.2,1466,Application Data,443,51503,
177,4.808143,3512060521,3232281142,TLSv1.2,1466,Application Data,443,51503,
178,4.808143,3512060521,3232281142,TLSv1.2,1466,Application Data,443,51503,
179,4.808143,3512060521,3232281142,TLSv1.2,1466,Application Data,443,51503,
180,4.808143,3512060521,3232281142,TLSv1.2,1466,Application Data,443,51503,
181,4.808143,3512060521,3232281142,TLSv1.2,1466,Application Data,443,51503,
182,4.808143,3512060521,3232281142,TLSv1.2,1466,Application Data,443,51503,
183,4.808143,3512060521,3232281142,TLSv1.2,1466,Application Data,443,51503,
184,4.808143,3512060521,3232281142,TLSv1.2,1350,Application Data,443,51503,
185,4.808385,3232281142,3512060521,TCP,54,51503  >  443 [ACK] Seq=7589 Ack=68237 Win=2333 Len=0,51503,443,
186,4.812498,3232281112,3232281343,UDP,77,38073  >  15600 Len=35,38073,15600,
188,4.960869,3512060521,3232281142,TLSv1.2,609,Application Data,443,51503,
189,4.962225,3512060521,3232281142,TLSv1.2,1040,Application Data,443,51503,
190,4.962225,3512060521,3232281142,TLSv1.2,1032,Application Data,443,51503,
191,4.962283,3232281142,3512060521,TCP,54,51503  >  443 [ACK] Seq=7589 Ack=70756 Win=2333 Len=0,51503,443,
192,4.965697,3512060521,3232281142,TLSv1.2,992,Application Data,443,51503,
193,4.965733,3232281142,3512060521,TCP,54,51503  >  443 [ACK] Seq=7589 Ack=71694 Win=2329 Len=0,51503,443,
194,4.966737,3512060521,3232281142,TLSv1.2,1466,Application Data,443,51503,
195,4.966737,3512060521,3232281142,TLSv1.2,196,Application Data,443,51503,
196,4.966782,3232281142,3512060521,TCP,54,51503  >  443 [ACK] Seq=7589 Ack=73248 Win=2333 Len=0,51503,443,
197,4.967963,3512060521,3232281142,TLSv1.2,1466,Application Data,443,51503,
198,4.967963,3512060521,3232281142,TLSv1.2,1466,Application Data,443,51503,
199,4.967963,3512060521,3232281142,TLSv1.2,1466,Application Data,443,51503,
200,4.967963,3512060521,3232281142,TLSv1.2,1356,Application Data,443,51503,
201,4.967963,3512060521,3232281142,TLSv1.2,191,Application Data,443,51503,
202,4.968024,3232281142,3512060521,TCP,54,51503  >  443 [ACK] Seq=7589 Ack=78923 Win=2333 Len=0,51503,443,
203,4.979649,3512060521,3232281142,TLSv1.2,1105,Application Data,443,51503,
204,4.979687,3232281142,3512060521,TCP,54,51503  >  443 [ACK] Seq=7589 Ack=79974 Win=2329 Len=0,51503,443,
205,4.982927,3512060521,3232281142,TLSv1.2,1466,Application Data,443,51503,
206,4.982927,3512060521,3232281142,TLSv1.2,1466,Application Data,443,51503,
207,4.982927,3512060521,3232281142,TLSv1.2,1466,Application Data,443,51503,
208,4.982927,3512060521,3232281142,TLSv1.2,1466,Application Data,443,51503,
209,4.982927,3512060521,3232281142,TLSv1.2,1466,Application Data,443,51503,
210,4.982927,3512060521,3232281142,TLSv1.2,1076,Application Data,443,51503,
211,4.982996,3232281142,3512060521,TCP,54,51503  >  443 [ACK] Seq=7589 Ack=88056 Win=2333 Len=0,51503,443,
212,5.05652,3512060521,3232281142,TLSv1.2,1466,Application Data,443,51503,
213,5.05652,3512060521,3232281142,TLSv1.2,1466,Application Data,443,51503,
214,5.05652,3512060521,3232281142,TLSv1.2,1466,Application Data,443,51503,
215,5.05652,3512060521,3232281142,TLSv1.2,1466,Application Data,443,51503,
216,5.05652,3512060521,3232281142,TLSv1.2,1466,Application Data,443,51503,
217,5.05652,3512060521,3232281142,TLSv1.2,1466,Application Data,443,51503,
218,5.05652,3512060521,3232281142,TLSv1.2,1466,Application Data,443,51503,
219,5.05652,3512060521,3232281142,TLSv1.2,1466,Application Data,443,51503,
220,5.05652,3512060521,3232281142,TLSv1.2,1466,Application Data,443,51503,
221,5.05652,3512060521,3232281142,TLSv1.2,1466,Application Data,443,51503,
222,5.05652,3512060521,3232281142,TLSv1.2,1466,Application Data,443,51503,
223,5.05652,3512060521,3232281142,TLSv1.2,673,Application Data,443,51503,
224,5.05652,3512060521,3232281142,TLSv1.2,1466,Application Data,443,51503,
225,5.05652,3512060521,3232281142,TLSv1.2,1466,Application Data,443,51503,
226,5.05652,3512060521,3232281142,TLSv1.2,1466,Application Data,443,51503,
227,5.05652,3512060521,3232281142,TLSv1.2,1466,Application Data,443,51503,
228,5.05652,3512060521,3232281142,TLSv1.2,1466,Application Data,443,51503,
229,5.05652,3512060521,3232281142,TLSv1.2,1466,Application Data,443,51503,
230,5.05652,3512060521,3232281142,TLSv1.2,1466,Application Data,443,51503,
231,5.056797,3232281142,3512060521,TCP,54,51503  >  443 [ACK] Seq=7589 Ack=114091 Win=2333 Len=0,51503,443,
232,5.058464,3232281142,1249755493,TCP,1466,51282  >  443 [ACK] Seq=7353 Ack=2065 Win=508 Len=1412 [TCP segment of a reassembled PDU],51282,443,
233,5.058464,3232281142,1249755493,TCP,1466,51282  >  443 [ACK] Seq=8765 Ack=2065 Win=508 Len=1412 [TCP segment of a reassembled PDU],51282,443,
234,5.058464,3232281142,1249755493,TLSv1.2,72,Application Data,51282,443,
235,5.058557,3232281142,1249755493,TCP,1466,51282  >  443 [ACK] Seq=10195 Ack=2065 Win=508 Len=1412 [TCP segment of a reassembled PDU],51282,443,
236,5.058557,3232281142,1249755493,TCP,1466,51282  >  443 [ACK] Seq=11607 Ack=2065 Win=508 Len=1412 [TCP segment of a reassembled PDU],51282,443,
237,5.058557,3232281142,1249755493,TCP,1466,51282  >  443 [ACK] Seq=13019 Ack=2065 Win=508 Len=1412 [TCP segment of a reassembled PDU],51282,443,
238,5.058557,3232281142,1249755493,TCP,1466,51282  >  443 [ACK] Seq=14431 Ack=2065 Win=508 Len=1412 [TCP segment of a reassembled PDU],51282,443,
239,5.058557,3232281142,1249755493,TCP,1466,51282  >  443 [ACK] Seq=15843 Ack=2065 Win=508 Len=1412 [TCP segment of a reassembled PDU],51282,443,
240,5.058557,3232281142,1249755493,TCP,1466,51282  >  443 [ACK] Seq=17255 Ack=2065 Win=508 Len=1412 [TCP segment of a reassembled PDU],51282,443,
241,5.058557,3232281142,1249755493,TCP,1466,51282  >  443 [ACK] Seq=18667 Ack=2065 Win=508 Len=1412 [TCP segment of a reassembled PDU],51282,443,
242,5.058557,3232281142,1249755493,TCP,1466,51282  >  443 [ACK] Seq=20079 Ack=2065 Win=508 Len=1412 [TCP segment of a reassembled PDU],51282,443,
243,5.058557,3232281142,1249755493,TCP,1466,51282  >  443 [ACK] Seq=21491 Ack=2065 Win=508 Len=1412 [TCP segment of a reassembled PDU],51282,443,
244,5.058557,3232281142,1249755493,TCP,1466,51282  >  443 [ACK] Seq=22903 Ack=2065 Win=508 Len=1412 [TCP segment of a reassembled PDU],51282,443,
245,5.058557,3232281142,1249755493,TCP,1466,51282  >  443 [ACK] Seq=24315 Ack=2065 Win=508 Len=1412 [TCP segment of a reassembled PDU],51282,443,
246,5.058557,3232281142,1249755493,TLSv1.2,928,Application Data,51282,443,
247,5.058639,3232281142,1249755493,TCP,1466,51282  >  443 [ACK] Seq=26601 Ack=2065 Win=508 Len=1412 [TCP segment of a reassembled PDU],51282,443,
248,5.058639,3232281142,1249755493,TCP,1466,51282  >  443 [ACK] Seq=28013 Ack=2065 Win=508 Len=1412 [TCP segment of a reassembled PDU],51282,443,
249,5.058639,3232281142,1249755493,TCP,1466,51282  >  443 [ACK] Seq=29425 Ack=2065 Win=508 Len=1412 [TCP segment of a reassembled PDU],51282,443,
250,5.058639,3232281142,1249755493,TCP,1466,51282  >  443 [ACK] Seq=30837 Ack=2065 Win=508 Len=1412 [TCP segment of a reassembled PDU],51282,443,
251,5.058639,3232281142,1249755493,TCP,1466,51282  >  443 [ACK] Seq=32249 Ack=2065 Win=508 Len=1412 [TCP segment of a reassembled PDU],51282,443,
252,5.058639,3232281142,1249755493,TCP,1466,51282  >  443 [ACK] Seq=33661 Ack=2065 Win=508 Len=1412 [TCP segment of a reassembled PDU],51282,443,
253,5.058639,3232281142,1249755493,TCP,1466,51282  >  443 [ACK] Seq=35073 Ack=2065 Win=508 Len=1412 [TCP segment of a reassembled PDU],51282,443,
254,5.058639,3232281142,1249755493,TCP,1466,51282  >  443 [ACK] Seq=36485 Ack=2065 Win=508 Len=1412 [TCP segment of a reassembled PDU],51282,443,
255,5.058639,3232281142,1249755493,TCP,1466,51282  >  443 [ACK] Seq=37897 Ack=2065 Win=508 Len=1412 [TCP segment of a reassembled PDU],51282,443,
256,5.058639,3232281142,1249755493,TCP,1466,51282  >  443 [ACK] Seq=39309 Ack=2065 Win=508 Len=1412 [TCP segment of a reassembled PDU],51282,443,
257,5.058639,3232281142,1249755493,TCP,1466,51282  >  443 [ACK] Seq=40721 Ack=2065 Win=508 Len=1412 [TCP segment of a reassembled PDU],51282,443,
258,5.058639,3232281142,1249755493,TLSv1.2,928,Application Data,51282,443,
259,5.058711,3232281142,1249755493,TCP,1466,51282  >  443 [ACK] Seq=43007 Ack=2065 Win=508 Len=1412 [TCP segment of a reassembled PDU],51282,443,
260,5.058711,3232281142,1249755493,TCP,1466,51282  >  443 [ACK] Seq=44419 Ack=2065 Win=508 Len=1412 [TCP segment of a reassembled PDU],51282,443,
261,5.058711,3232281142,1249755493,TCP,1466,51282  >  443 [ACK] Seq=45831 Ack=2065 Win=508 Len=1412 [TCP segment of a reassembled PDU],51282,443,
262,5.058711,3232281142,1249755493,TCP,1466,51282  >  443 [ACK] Seq=47243 Ack=2065 Win=508 Len=1412 [TCP segment of a reassembled PDU],51282,443,
263,5.058711,3232281142,1249755493,TCP,1466,51282  >  443 [ACK] Seq=48655 Ack=2065 Win=508 Len=1412 [TCP segment of a reassembled PDU],51282,443,
264,5.058711,3232281142,1249755493,TCP,1466,51282  >  443 [ACK] Seq=50067 Ack=2065 Win=508 Len=1412 [TCP segment of a reassembled PDU],51282,443,
265,5.058711,3232281142,1249755493,TCP,1466,51282  >  443 [ACK] Seq=51479 Ack=2065 Win=508 Len=1412 [TCP segment of a reassembled PDU],51282,443,
266,5.058711,3232281142,1249755493,TCP,1466,51282  >  443 [ACK] Seq=52891 Ack=2065 Win=508 Len=1412 [TCP segment of a reassembled PDU],51282,443,
267,5.058711,3232281142,1249755493,TCP,1466,51282  >  443 [ACK] Seq=54303 Ack=2065 Win=508 Len=1412 [TCP segment of a reassembled PDU],51282,443,
268,5.058711,3232281142,1249755493,TCP,1466,51282  >  443 [ACK] Seq=55715 Ack=2065 Win=508 Len=1412 [TCP segment of a reassembled PDU],51282,443,
269,5.058711,3232281142,1249755493,TCP,1466,51282  >  443 [ACK] Seq=57127 Ack=2065 Win=508 Len=1412 [TCP segment of a reassembled PDU],51282,443,
270,5.058711,3232281142,1249755493,TLSv1.2,928,Application Data,51282,443,
271,5.058732,3512060521,3232281142,TLSv1.2,1466,Application Data,443,51503,
272,5.058732,3512060521,3232281142,TLSv1.2,1466,Application Data,443,51503,
273,5.058732,3512060521,3232281142,TLSv1.2,1466,Application Data,443,51503,
274,5.058732,3512060521,3232281142,TLSv1.2,1466,Application Data,443,51503,
275,5.058732,3512060521,3232281142,TLSv1.2,1179,Application Data,443,51503,
276,5.058732,3512060521,3232281142,TLSv1.2,1466,Application Data,443,51503,
277,5.058732,3512060521,3232281142,TLSv1.2,1466,Application Data,443,51503,
278,5.058732,3512060521,3232281142,TLSv1.2,1466,Application Data,443,51503,
279,5.058732,3512060521,3232281142,TLSv1.2,1466,Application Data,443,51503,
280,5.058732,3512060521,3232281142,TLSv1.2,1466,Application Data,443,51503,
281,5.058732,3512060521,3232281142,TLSv1.2,1466,Application Data,443,51503,
282,5.058732,3512060521,3232281142,TLSv1.2,1466,Application Data,443,51503,
283,5.058732,3512060521,3232281142,TLSv1.2,1466,Application Data,443,51503,
284,5.058732,3512060521,3232281142,TLSv1.2,1466,Application Data,443,51503,
285,5.058732,3512060521,3232281142,TLSv1.2,1466,Application Data,443,51503,
286,5.058732,3512060521,3232281142,TLSv1.2,1466,Application Data,443,51503,
287,5.058732,3512060521,3232281142,TLSv1.2,1466,Application Data,443,51503,
288,5.058732,3512060521,3232281142,TLSv1.2,1466,Application Data,443,51503,
289,5.058732,3512060521,3232281142,TLSv1.2,1466,Application Data,443,51503,
290,5.058732,3512060521,3232281142,TLSv1.2,1466,Application Data,443,51503,
291,5.058732,3512060521,3232281142,TLSv1.2,1466,Application Data,443,51503,
292,5.058732,3512060521,3232281142,TLSv1.2,1466,Application Data,443,51503,
293,5.058732,3512060521,3232281142,TLSv1.2,459,Application Data,443,51503,
294,5.058785,3232281142,1249755493,TCP,1466,51282  >  443 [ACK] Seq=59413 Ack=2065 Win=508 Len=1412 [TCP segment of a reassembled PDU],51282,443,
295,5.058785,3232281142,1249755493,TCP,1466,51282  >  443 [ACK] Seq=60825 Ack=2065 Win=508 Len=1412 [TCP segment of a reassembled PDU],51282,443,
296,5.058785,3232281142,1249755493,TCP,1466,51282  >  443 [ACK] Seq=62237 Ack=2065 Win=508 Len=1412 [TCP segment of a reassembled PDU],51282,443,
297,5.058785,3232281142,1249755493,TCP,1466,51282  >  443 [ACK] Seq=63649 Ack=2065 Win=508 Len=1412 [TCP segment of a reassembled PDU],51282,443,
298,5.058785,3232281142,1249755493,TCP,1466,51282  >  443 [ACK] Seq=65061 Ack=2065 Win=508 Len=1412 [TCP segment of a reassembled PDU],51282,443,
299,5.058785,3232281142,1249755493,TCP,1466,51282  >  443 [ACK] Seq=66473 Ack=2065 Win=508 Len=1412 [TCP segment of a reassembled PDU],51282,443,
300,5.058785,3232281142,1249755493,TCP,1466,51282  >  443 [ACK] Seq=67885 Ack=2065 Win=508 Len=1412 [TCP segment of a reassembled PDU],51282,443,
301,5.058785,3232281142,1249755493,TCP,1466,51282  >  443 [ACK] Seq=69297 Ack=2065 Win=508 Len=1412 [TCP segment of a reassembled PDU],51282,443,
302,5.058785,3232281142,1249755493,TCP,1466,51282  >  443 [ACK] Seq=70709 Ack=2065 Win=508 Len=1412 [TCP segment of a reassembled PDU],51282,443,
303,5.058785,3232281142,1249755493,TCP,1466,51282  >  443 [ACK] Seq=72121 Ack=2065 Win=508 Len=1412 [TCP segment of a reassembled PDU],51282,443,
304,5.058785,3232281142,1249755493,TCP,1466,51282  >  443 [ACK] Seq=73533 Ack=2065 Win=508 Len=1412 [TCP segment of a reassembled PDU],51282,443,
305,5.058785,3232281142,1249755493,TLSv1.2,928,Application Data,51282,443,
306,5.058858,3232281142,1249755493,TCP,1466,51282  >  443 [ACK] Seq=75819 Ack=2065 Win=508 Len=1412 [TCP segment of a reassembled PDU],51282,443,
307,5.058858,3232281142,1249755493,TCP,1466,51282  >  443 [ACK] Seq=77231 Ack=2065 Win=508 Len=1412 [TCP segment of a reassembled PDU],51282,443,
308,5.058858,3232281142,1249755493,TCP,1466,51282  >  443 [ACK] Seq=78643 Ack=2065 Win=508 Len=1412 [TCP segment of a reassembled PDU],51282,443,
309,5.058858,3232281142,1249755493,TCP,1466,51282  >  443 [ACK] Seq=80055 Ack=2065 Win=508 Len=1412 [TCP segment of a reassembled PDU],51282,443,
310,5.058858,3232281142,1249755493,TCP,1466,51282  >  443 [ACK] Seq=81467 Ack=2065 Win=508 Len=1412 [TCP segment of a reassembled PDU],51282,443,
311,5.058858,3232281142,1249755493,TCP,1466,51282  >  443 [ACK] Seq=82879 Ack=2065 Win=508 Len=1412 [TCP segment of a reassembled PDU],51282,443,
312,5.058858,3232281142,1249755493,TCP,1466,51282  >  443 [ACK] Seq=84291 Ack=2065 Win=508 Len=1412 [TCP segment of a reassembled PDU],51282,443,
313,5.058858,3232281142,1249755493,TCP,1466,51282  >  443 [ACK] Seq=85703 Ack=2065 Win=508 Len=1412 [TCP segment of a reassembled PDU],51282,443,
314,5.058858,3232281142,1249755493,TCP,1466,51282  >  443 [ACK] Seq=87115 Ack=2065 Win=508 Len=1412 [TCP segment of a reassembled PDU],51282,443,
315,5.058858,3232281142,1249755493,TCP,1466,51282  >  443 [ACK] Seq=88527 Ack=2065 Win=508 Len=1412 [TCP segment of a reassembled PDU],51282,443,
316,5.058858,3232281142,1249755493,TCP,1466,51282  >  443 [ACK] Seq=89939 Ack=2065 Win=508 Len=1412 [TCP segment of a reassembled PDU],51282,443,
317,5.058858,3232281142,1249755493,TLSv1.2,928,Application Data,51282,443,
318,5.058947,3232281142,1249755493,TCP,1466,51282  >  443 [ACK] Seq=92225 Ack=2065 Win=508 Len=1412 [TCP segment of a reassembled PDU],51282,443,
319,5.058947,3232281142,1249755493,TCP,1466,51282  >  443 [ACK] Seq=93637 Ack=2065 Win=508 Len=1412 [TCP segment of a reassembled PDU],51282,443,
320,5.058947,3232281142,1249755493,TCP,1466,51282  >  443 [ACK] Seq=95049 Ack=2065 Win=508 Len=1412 [TCP segment of a reassembled PDU],51282,443,
321,5.058947,3232281142,1249755493,TCP,1466,51282  >  443 [ACK] Seq=96461 Ack=2065 Win=508 Len=1412 [TCP segment of a reassembled PDU],51282,443,
322,5.058947,3232281142,1249755493,TCP,1466,51282  >  443 [ACK] Seq=97873 Ack=2065 Win=508 Len=1412 [TCP segment of a reassembled PDU],51282,443,
323,5.058947,3232281142,1249755493,TCP,1466,51282  >  443 [ACK] Seq=99285 Ack=2065 Win=508 Len=1412 [TCP segment of a reassembled PDU],51282,443,
324,5.058947,3232281142,1249755493,TCP,1466,51282  >  443 [ACK] Seq=100697 Ack=2065 Win=508 Len=1412 [TCP segment of a reassembled PDU],51282,443,
325,5.058947,3232281142,1249755493,TCP,1466,51282  >  443 [ACK] Seq=102109 Ack=2065 Win=508 Len=1412 [TCP segment of a reassembled PDU],51282,443,
326,5.058947,3232281142,1249755493,TCP,1466,51282  >  443 [ACK] Seq=103521 Ack=2065 Win=508 Len=1412 [TCP segment of a reassembled PDU],51282,443,
327,5.058947,3232281142,1249755493,TCP,1466,51282  >  443 [ACK] Seq=104933 Ack=2065 Win=508 Len=1412 [TCP segment of a reassembled PDU],51282,443,
328,5.058947,3232281142,1249755493,TCP,1466,51282  >  443 [ACK] Seq=106345 Ack=2065 Win=508 Len=1412 [TCP segment of a reassembled PDU],51282,443,
329,5.058947,3232281142,1249755493,TLSv1.2,928,Application Data,51282,443,
330,5.058984,3232281142,3512060521,TCP,54,51503  >  443 [ACK] Seq=7589 Ack=145273 Win=2333 Len=0,51503,443,
331,5.059064,3232281142,1249755493,TCP,1466,51282  >  443 [ACK] Seq=108631 Ack=2065 Win=508 Len=1412 [TCP segment of a reassembled PDU],51282,443,
332,5.059064,3232281142,1249755493,TCP,1466,51282  >  443 [ACK] Seq=110043 Ack=2065 Win=508 Len=1412 [TCP segment of a reassembled PDU],51282,443,
333,5.059064,3232281142,1249755493,TCP,1466,51282  >  443 [ACK] Seq=111455 Ack=2065 Win=508 Len=1412 [TCP segment of a reassembled PDU],51282,443,
334,5.059064,3232281142,1249755493,TCP,1466,51282  >  443 [ACK] Seq=112867 Ack=2065 Win=508 Len=1412 [TCP segment of a reassembled PDU],51282,443,
335,5.059064,3232281142,1249755493,TCP,1466,51282  >  443 [ACK] Seq=114279 Ack=2065 Win=508 Len=1412 [TCP segment of a reassembled PDU],51282,443,
336,5.059064,3232281142,1249755493,TCP,1466,51282  >  443 [ACK] Seq=115691 Ack=2065 Win=508 Len=1412 [TCP segment of a reassembled PDU],51282,443,
337,5.059064,3232281142,1249755493,TCP,1466,51282  >  443 [ACK] Seq=117103 Ack=2065 Win=508 Len=1412 [TCP segment of a reassembled PDU],51282,443,
338,5.059064,3232281142,1249755493,TCP,1466,51282  >  443 [ACK] Seq=118515 Ack=2065 Win=508 Len=1412 [TCP segment of a reassembled PDU],51282,443,
339,5.059064,3232281142,1249755493,TCP,1466,51282  >  443 [ACK] Seq=119927 Ack=2065 Win=508 Len=1412 [TCP segment of a reassembled PDU],51282,443,
340,5.059064,3232281142,1249755493,TCP,1466,51282  >  443 [ACK] Seq=121339 Ack=2065 Win=508 Len=1412 [TCP segment of a reassembled PDU],51282,443,
341,5.059064,3232281142,1249755493,TCP,1466,51282  >  443 [ACK] Seq=122751 Ack=2065 Win=508 Len=1412 [TCP segment of a reassembled PDU],51282,443,
342,5.059064,3232281142,1249755493,TLSv1.2,928,Application Data,51282,443,
343,5.059147,3232281142,1249755493,TCP,1466,51282  >  443 [ACK] Seq=125037 Ack=2065 Win=508 Len=1412 [TCP segment of a reassembled PDU],51282,443,
344,5.059147,3232281142,1249755493,TCP,1466,51282  >  443 [ACK] Seq=126449 Ack=2065 Win=508 Len=1412 [TCP segment of a reassembled PDU],51282,443,
345,5.059147,3232281142,1249755493,TCP,1466,51282  >  443 [ACK] Seq=127861 Ack=2065 Win=508 Len=1412 [TCP segment of a reassembled PDU],51282,443,
346,5.059147,3232281142,1249755493,TCP,1466,51282  >  443 [ACK] Seq=129273 Ack=2065 Win=508 Len=1412 [TCP segment of a reassembled PDU],51282,443,
347,5.059147,3232281142,1249755493,TCP,1466,51282  >  443 [ACK] Seq=130685 Ack=2065 Win=508 Len=1412 [TCP segment of a reassembled PDU],51282,443,
348,5.059147,3232281142,1249755493,TCP,1466,51282  >  443 [ACK] Seq=132097 Ack=2065 Win=508 Len=1412 [TCP segment of a reassembled PDU],51282,443,
349,5.059147,3232281142,1249755493,TCP,1466,51282  >  443 [ACK] Seq=133509 Ack=2065 Win=508 Len=1412 [TCP segment of a reassembled PDU],51282,443,
350,5.059147,3232281142,1249755493,TCP,1466,51282  >  443 [ACK] Seq=134921 Ack=2065 Win=508 Len=1412 [TCP segment of a reassembled PDU],51282,443,
351,5.059147,3232281142,1249755493,TCP,1466,51282  >  443 [ACK] Seq=136333 Ack=2065 Win=508 Len=1412 [TCP segment of a reassembled PDU],51282,443,
352,5.059147,3232281142,1249755493,TCP,1466,51282  >  443 [ACK] Seq=137745 Ack=2065 Win=508 Len=1412 [TCP segment of a reassembled PDU],51282,443,
353,5.059147,3232281142,1249755493,TCP,1466,51282  >  443 [ACK] Seq=139157 Ack=2065 Win=508 Len=1412 [TCP segment of a reassembled PDU],51282,443,
354,5.059147,3232281142,1249755493,TLSv1.2,928,Application Data,51282,443,
355,5.059228,3232281142,1249755493,TCP,1466,51282  >  443 [ACK] Seq=141443 Ack=2065 Win=508 Len=1412 [TCP segment of a reassembled PDU],51282,443,
356,5.059228,3232281142,1249755493,TCP,1466,51282  >  443 [ACK] Seq=142855 Ack=2065 Win=508 Len=1412 [TCP segment of a reassembled PDU],51282,443,
357,5.059228,3232281142,1249755493,TCP,1466,51282  >  443 [ACK] Seq=144267 Ack=2065 Win=508 Len=1412 [TCP segment of a reassembled PDU],51282,443,
358,5.059228,3232281142,1249755493,TCP,1466,51282  >  443 [ACK] Seq=145679 Ack=2065 Win=508 Len=1412 [TCP segment of a reassembled PDU],51282,443,
359,5.059228,3232281142,1249755493,TCP,1466,51282  >  443 [ACK] Seq=147091 Ack=2065 Win=508 Len=1412 [TCP segment of a reassembled PDU],51282,443,
360,5.059228,3232281142,1249755493,TCP,1466,51282  >  443 [ACK] Seq=148503 Ack=2065 Win=508 Len=1412 [TCP segment of a reassembled PDU],51282,443,
361,5.059228,3232281142,1249755493,TCP,1466,51282  >  443 [ACK] Seq=149915 Ack=2065 Win=508 Len=1412 [TCP segment of a reassembled PDU],51282,443,
362,5.059228,3232281142,1249755493,TCP,1466,51282  >  443 [ACK] Seq=151327 Ack=2065 Win=508 Len=1412 [TCP segment of a reassembled PDU],51282,443,
363,5.059228,3232281142,1249755493,TCP,1466,51282  >  443 [ACK] Seq=152739 Ack=2065 Win=508 Len=1412 [TCP segment of a reassembled PDU],51282,443,
364,5.059228,3232281142,1249755493,TCP,1466,51282  >  443 [ACK] Seq=154151 Ack=2065 Win=508 Len=1412 [TCP segment of a reassembled PDU],51282,443,
365,5.059228,3232281142,1249755493,TCP,1466,51282  >  443 [ACK] Seq=155563 Ack=2065 Win=508 Len=1412 [TCP segment of a reassembled PDU],51282,443,
366,5.059228,3232281142,1249755493,TLSv1.2,928,Application Data,51282,443,
367,5.059307,3232281142,1249755493,TCP,1466,51282  >  443 [ACK] Seq=157849 Ack=2065 Win=508 Len=1412 [TCP segment of a reassembled PDU],51282,443,
368,5.059307,3232281142,1249755493,TCP,1466,51282  >  443 [ACK] Seq=159261 Ack=2065 Win=508 Len=1412 [TCP segment of a reassembled PDU],51282,443,
369,5.059307,3232281142,1249755493,TCP,1466,51282  >  443 [ACK] Seq=160673 Ack=2065 Win=508 Len=1412 [TCP segment of a reassembled PDU],51282,443,
370,5.059307,3232281142,1249755493,TCP,1466,51282  >  443 [ACK] Seq=162085 Ack=2065 Win=508 Len=1412 [TCP segment of a reassembled PDU],51282,443,
371,5.059307,3232281142,1249755493,TCP,1466,51282  >  443 [ACK] Seq=163497 Ack=2065 Win=508 Len=1412 [TCP segment of a reassembled PDU],51282,443,
372,5.059307,3232281142,1249755493,TCP,1466,51282  >  443 [ACK] Seq=164909 Ack=2065 Win=508 Len=1412 [TCP segment of a reassembled PDU],51282,443,
373,5.059307,3232281142,1249755493,TCP,1466,51282  >  443 [ACK] Seq=166321 Ack=2065 Win=508 Len=1412 [TCP segment of a reassembled PDU],51282,443,
374,5.059307,3232281142,1249755493,TCP,1466,51282  >  443 [ACK] Seq=167733 Ack=2065 Win=508 Len=1412 [TCP segment of a reassembled PDU],51282,443,
375,5.059307,3232281142,1249755493,TCP,1466,51282  >  443 [ACK] Seq=169145 Ack=2065 Win=508 Len=1412 [TCP segment of a reassembled PDU],51282,443,
376,5.059307,3232281142,1249755493,TCP,1466,51282  >  443 [ACK] Seq=170557 Ack=2065 Win=508 Len=1412 [TCP segment of a reassembled PDU],51282,443,
377,5.059307,3232281142,1249755493,TCP,1466,51282  >  443 [ACK] Seq=171969 Ack=2065 Win=508 Len=1412 [TCP segment of a reassembled PDU],51282,443,
378,5.059307,3232281142,1249755493,TLSv1.2,928,Application Data,51282,443,
379,5.059387,3232281142,1249755493,TCP,1466,51282  >  443 [ACK] Seq=174255 Ack=2065 Win=508 Len=1412 [TCP segment of a reassembled PDU],51282,443,
380,5.059387,3232281142,1249755493,TCP,1466,51282  >  443 [ACK] Seq=175667 Ack=2065 Win=508 Len=1412 [TCP segment of a reassembled PDU],51282,443,
381,5.059387,3232281142,1249755493,TCP,1466,51282  >  443 [ACK] Seq=177079 Ack=2065 Win=508 Len=1412 [TCP segment of a reassembled PDU],51282,443,
382,5.059387,3232281142,1249755493,TCP,1466,51282  >  443 [ACK] Seq=178491 Ack=2065 Win=508 Len=1412 [TCP segment of a reassembled PDU],51282,443,
383,5.059387,3232281142,1249755493,TCP,1466,51282  >  443 [ACK] Seq=179903 Ack=2065 Win=508 Len=1412 [TCP segment of a reassembled PDU],51282,443,
384,5.059387,3232281142,1249755493,TCP,1466,51282  >  443 [ACK] Seq=181315 Ack=2065 Win=508 Len=1412 [TCP segment of a reassembled PDU],51282,443,
385,5.059387,3232281142,1249755493,TCP,1466,51282  >  443 [ACK] Seq=182727 Ack=2065 Win=508 Len=1412 [TCP segment of a reassembled PDU],51282,443,
386,5.059387,3232281142,1249755493,TCP,1466,51282  >  443 [ACK] Seq=184139 Ack=2065 Win=508 Len=1412 [TCP segment of a reassembled PDU],51282,443,
387,5.059387,3232281142,1249755493,TCP,1466,51282  >  443 [ACK] Seq=185551 Ack=2065 Win=508 Len=1412 [TCP segment of a reassembled PDU],51282,443,
388,5.059387,3232281142,1249755493,TCP,1466,51282  >  443 [ACK] Seq=186963 Ack=2065 Win=508 Len=1412 [TCP segment of a reassembled PDU],51282,443,
389,5.059387,3232281142,1249755493,TCP,1466,51282  >  443 [ACK] Seq=188375 Ack=2065 Win=508 Len=1412 [TCP segment of a reassembled PDU],51282,443,
390,5.059387,3232281142,1249755493,TLSv1.2,928,Application Data,51282,443,
391,5.059467,3232281142,1249755493,TCP,1466,51282  >  443 [ACK] Seq=190661 Ack=2065 Win=508 Len=1412 [TCP segment of a reassembled PDU],51282,443,
392,5.059467,3232281142,1249755493,TCP,1466,51282  >  443 [ACK] Seq=192073 Ack=2065 Win=508 Len=1412 [TCP segment of a reassembled PDU],51282,443,
393,5.059467,3232281142,1249755493,TCP,1466,51282  >  443 [ACK] Seq=193485 Ack=2065 Win=508 Len=1412 [TCP segment of a reassembled PDU],51282,443,
394,5.059467,3232281142,1249755493,TCP,1466,51282  >  443 [ACK] Seq=194897 Ack=2065 Win=508 Len=1412 [TCP segment of a reassembled PDU],51282,443,
